A1: 公示日期：2022 年8月30日-2022年9月6日
A2: 补贴标准（86元/亩）
A3: 序号 | B3: 村民小组 | C3: 补贴对象 | D3: 补贴面积（亩） | E3: 补贴金额（元） | F3: 五华农商行账号尾号
A4: =ROW()-4 -> 1 | B4: 宝星 | C4: 陈国强 | D4: 1.6215 | E4: 139.449 | F4: 3221
A5: =ROW()-4 -> 2 | B5: 宝星 | C5: 陈胜军 | D5: 3.4155 | E5: 293.733 | F5: 4213
A6: =ROW()-4 -> 3 | B6: 宝星 | C6: 陈顺着 | D6: 3.4914 | E6: 300.2604 | F6: 3152
A7: =ROW()-4 -> 4 | B7: 宝星 | C7: 陈发新 | D7: 6.7896 | E7: 583.9056 | F7: 7571
A8: =ROW()-4 -> 5 | B8: 宝星 | C8: 陈达棠 | D8: 3.5535 | E8: 305.601 | F8: 3232
A9: =ROW()-4 -> 6 | B9: 宝星 | C9: 陈会棠 | D9: 3.5328 | E9: 303.8208 | F9: 3210
A10: =ROW()-4 -> 7 | B10: 宝星 | C10: 陈锦泉 | D10: 4.6023 | E10: 395.7978 | F10: 4362
A11: =ROW()-4 -> 8 | B11: 宝星 | C11: 张六兰 | D11: 2.7255 | E11: 234.393 | F11: 3129
A12: =ROW()-4 -> 9 | B12: 宝星 | C12: 陈谷友 | D12: 2.3391 | E12: 201.1626 | F12: 3141
A13: =ROW()-4 -> 10 | B13: 宝星 | C13: 陈振群 | D13: 2.3667 | E13: 203.5362 | F13: 3209
A14: =ROW()-4 -> 11 | B14: 宝星 | C14: 陈振青 | D14: 2.4702 | E14: 212.4372 | F14: 3265
A15: =ROW()-4 -> 12 | B15: 宝星 | C15: 陈振军 | D15: 3.2499 | E15: 279.4914 | F15: 3196
A16: =ROW()-4 -> 13 | B16: 宝星 | C16: 陈育泉 | D16: 3.0498 | E16: 262.2828 | F16: 3118
A17: =ROW()-4 -> 14 | B17: 宝星 | C17: 陈谨泉 | D17: 6.1203 | E17: 526.3458 | F17: 9878
A18: =ROW()-4 -> 15 | B18: 宝星 | C18: 陈想权 | D18: 3.2223 | E18: 277.1178 | F18: 2576
A19: =ROW()-4 -> 16 | B19: 宝星 | C19: 陈吉权 | D19: 3.2292 | E19: 277.7112 | F19: 2263
A20: =ROW()-4 -> 17 | B20: 宝星 | C20: 陈新泉 | D20: 4.9059 | E20: 421.9074 | F20: 3174
A21: =ROW()-4 -> 18 | B21: 宝星 | C21: 陈中权 | D21: 3.8916 | E21: 334.6776 | F21: 3254
A22: =ROW()-4 -> 19 | B22: 金星 | C22: 张玉香 | D22: 4.4643 | E22: 383.9298 | F22: 6400
A23: =ROW()-4 -> 20 | B23: 金星 | C23: 张百华 | D23: 3.0912 | E23: 265.8432 | F23: 2932
A24: =ROW()-4 -> 21 | B24: 金星 | C24: 张泗林 | D24: 2.9532 | E24: 253.9752 | F24: 8122
A25: =ROW()-4 -> 22 | B25: 金星 | C25: 张周零 | D25: 7.8177 | E25: 672.3222 | F25: 7083
A26: =ROW()-4 -> 23 | B26: 金星 | C26: 张伟坤 | D26: 3.2637 | E26: 280.6782 | F26: 2829
A27: =ROW()-4 -> 24 | B27: 金星 | C27: 张锡今 | D27: 1.4766 | E27: 126.9876 | F27: 2909
A28: =ROW()-4 -> 25 | B28: 金星 | C28: 张耀飞 | D28: 3.6294 | E28: 312.1284 | F28: 2830
A29: =ROW()-4 -> 26 | B29: 金星 | C29: 张佛先 | D29: 3.3327 | E29: 286.6122 | F29: 2841
A30: =ROW()-4 -> 27 | B30: 金星 | C30: 张坤权 | D30: 1.863 | E30: 160.218 | F30: 0529
A31: =ROW()-4 -> 28 | B31: 金星 | C31: 张育权 | D31: 1.3248 | E31: 113.9328 | F31: 2818
A32: =ROW()-4 -> 29 | B32: 金星 | C32: 张满权 | D32: 1.0005 | E32: 86.043 | F32: 8003
A33: =ROW()-4 -> 30 | B33: 金星 | C33: 张亚权 | D33: 5.4165 | E33: 465.819 | F33: 2874
A34: =ROW()-4 -> 31 | B34: 金星 | C34: 张运均 | D34: 2.0493 | E34: 176.2398 | F34: 2807
A35: =ROW()-4 -> 32 | B35: 金星 | C35: 张仕均 | D35: 1.9803 | E35: 170.3058 | F35: 0552
A36: =ROW()-4 -> 33 | B36: 金星 | C36: 张会均 | D36: 2.4357 | E36: 209.4702 | F36: 6057
A37: =ROW()-4 -> 34 | B37: 金星 | C37: 张卫今 | D37: 4.7748 | E37: 410.6328 | F37: 2954
A38: =ROW()-4 -> 35 | B38: 金星 | C38: 张达新 | D38: 4.0572 | E38: 348.9192 | F38: 2705
A39: =ROW()-4 -> 36 | B39: 金星 | C39: 张春元 | D39: 1.9734 | E39: 169.7124 | F39: 7766
A40: =ROW()-4 -> 37 | B40: 金星 | C40: 张春良 | D40: 1.449 | E40: 124.614 | F40: 9829
A41: =ROW()-4 -> 38 | B41: 金星 | C41: 张祥云 | D41: 1.173 | E41: 100.878 | F41: 8282
A42: =ROW()-4 -> 39 | B42: 金星 | C42: 张春文 | D42: 1.1592 | E42: 99.6912 | F42: 3450
A43: =ROW()-4 -> 40 | B43: 金星 | C43: 张春华 | D43: 3.4086 | E43: 293.1396 | F43: 3521
A44: =ROW()-4 -> 41 | B44: 金星 | C44: 张春祥 | D44: 3.4224 | E44: 294.3264 | F44: 2670
A45: =ROW()-4 -> 42 | B45: 金星 | C45: 陈祝英 | D45: 2.5254 | E45: 217.1844 | F45: 2012
A46: =ROW()-4 -> 43 | B46: 金星 | C46: 张金贤 | D46: 2.2218 | E46: 191.0748 | F46: 2727
A47: =ROW()-4 -> 44 | B47: 金星 | C47: 张远明 | D47: 1.3524 | E47: 116.3064 | F47: 2772
A48: =ROW()-4 -> 45 | B48: 金星 | C48: 张志文 | D48: 1.3317 | E48: 114.5262 | F48: 2783
A49: =ROW()-4 -> 46 | B49: 金星 | C49: 张远清 | D49: 1.4007 | E49: 120.4602 | F49: 8308
A50: =ROW()-4 -> 47 | B50: 金星 | C50: 张定今 | D50: 2.4426 | E50: 210.0636 | F50: 3910
A51: =ROW()-4 -> 48 | B51: 金星 | C51: 张学零 | D51: 2.2011 | E51: 189.2946 | F51: 0510
A52: =ROW()-4 -> 49 | B52: 金星 | C52: 张乃金 | D52: 3.1602 | E52: 271.7772 | F52: 2852
A53: =ROW()-4 -> 50 | B53: 金星 | C53: 张锡泉 | D53: 3.2154 | E53: 276.5244 | F53: 2738
A54: =ROW()-4 -> 51 | B54: 金星 | C54: 陈亚四 | D54: 2.8359 | E54: 243.8874 | F54: 3889
A55: =ROW()-4 -> 52 | B55: 金星 | C55: 张溜民 | D55: 2.8428 | E55: 244.4808 | F55: 3025
A56: =ROW()-4 -> 53 | B56: 金星 | C56: 张乃运 | D56: 4.7472 | E56: 408.2592 | F56: 2750
A57: =ROW()-4 -> 54 | B57: 金星 | C57: 张远泉 | D57: 2.2908 | E57: 197.0088 | F57: 4641
A58: =ROW()-4 -> 55 | B58: 金星 | C58: 张锡文 | D58: 2.1045 | E58: 180.987 | F58: 6669
A59: =ROW()-4 -> 56 | B59: 旗星 | C59: 张东花 | D59: 1.4214 | E59: 122.2404 | F59: 2454
A60: =ROW()-4 -> 57 | B60: 旗星 | C60: 陈水强 | D60: 0.6279 | E60: 53.9994 | F60: 8204
A61: =ROW()-4 -> 58 | B61: 旗星 | C61: 陈水权 | D61: 2.6151 | E61: 224.8986 | F61: 5216
A62: =ROW()-4 -> 59 | B62: 旗星 | C62: 陈平山 | D62: 3.7191 | E62: 319.8426 | F62: 8407
A63: =ROW()-4 -> 60 | B63: 旗星 | C63: 陈焕权 | D63: 3.0705 | E63: 264.063 | F63: 6545
A64: =ROW()-4 -> 61 | B64: 旗星 | C64: 陈浪华 | D64: 8.4387 | E64: 725.7282 | F64: 3367
A65: =ROW()-4 -> 62 | B65: 旗星 | C65: 陈渐新 | D65: 4.2573 | E65: 366.1278 | F65: 3334
A66: =ROW()-4 -> 63 | B66: 旗星 | C66: 陈贵文 | D66: 4.5816 | E66: 394.0176 | F66: 3469
A67: =ROW()-4 -> 64 | B67: 旗星 | C67: 陈春元 | D67: 3.1533 | E67: 271.1838 | F67: 3425
A68: =ROW()-4 -> 65 | B68: 旗星 | C68: 陈汉春 | D68: 1.2144 | E68: 104.4384 | F68: 3492
A69: =ROW()-4 -> 66 | B69: 旗星 | C69: 陈春华 | D69: 4.416 | E69: 379.776 | F69: 3527
A70: =ROW()-4 -> 67 | B70: 旗星 | C70: 陈贵平 | D70: 1.6422 | E70: 141.2292 | F70: 3436
A71: =ROW()-4 -> 68 | B71: 旗星 | C71: 陈振华 | D71: 2.6289 | E71: 226.0854 | F71: 3458
A72: =ROW()-4 -> 69 | B72: 旗星 | C72: 陈育新 | D72: 3.4914 | E72: 300.2604 | F72: 3505
A73: =ROW()-4 -> 70 | B73: 旗星 | C73: 曾凤容 | D73: 1.8492 | E73: 159.0312 | F73: 4484
A74: =ROW()-4 -> 71 | B74: 旗星 | C74: 陈继球 | D74: 1.9182 | E74: 164.9652 | F74: 3403
A75: =ROW()-4 -> 72 | B75: 旗星 | C75: 陈汉坤 | D75: 3.1257 | E75: 268.8102 | F75: 3470
A76: =ROW()-4 -> 73 | B76: 旗星 | C76: 陈敬良 | D76: 4.1745 | E76: 359.007 | F76: 3301
A77: =ROW()-4 -> 74 | B77: 旗星 | C77: 陈爱华 | D77: 2.9808 | E77: 256.3488 | F77: 3538
A78: =ROW()-4 -> 75 | B78: 旗星 | C78: 陈清良 | D78: 5.9685 | E78: 513.291 | F78: 3276
A79: =ROW()-4 -> 76 | B79: 旗星 | C79: 陈且友 | D79: 4.5402 | E79: 390.4572 | F79: 3516
A80: =ROW()-4 -> 77 | B80: 旗星 | C80: 张园香 | D80: 3.1395 | E80: 269.997 | F80: 3323
A81: =ROW()-4 -> 78 | B81: 旗星 | C81: 李锡梅 | D81: 3.8295 | E81: 329.337 | F81: 7743
A82: =ROW()-4 -> 79 | B82: 旗星 | C82: 陈茂权 | D82: 2.9118 | E82: 250.4148 | F82: 9267
A83: =ROW()-4 -> 80 | B83: 旗星 | C83: 陈振叨 | D83: 3.0567 | E83: 262.8762 | F83: 3378
A84: =ROW()-4 -> 81 | B84: 旗星 | C84: 陈汉华 | D84: 6.5481 | E84: 563.1366 | F84: 3481
A85: =ROW()-4 -> 82 | B85: 旗星 | C85: 陈丽华 | D85: 4.8645 | E85: 418.347 | F85: 3389
A86: =ROW()-4 -> 83 | B86: 五星 | C86: 张锦华 | D86: 5.1819 | E86: 445.6434 | F86: 3027
A87: =ROW()-4 -> 84 | B87: 五星 | C87: 张远坤 | D87: 2.1735 | E87: 186.921 | F87: 6755
A88: =ROW()-4 -> 85 | B88: 五星 | C88: 张关成 | D88: 1.7043 | E88: 146.5698 | F88: 3072
A89: =ROW()-4 -> 86 | B89: 五星 | C89: 张关清 | D89: 2.0769 | E89: 178.6134 | F89: 0545
A90: =ROW()-4 -> 87 | B90: 五星 | C90: 张添泉 | D90: 5.2854 | E90: 454.5444 | F90: 3005
A91: =ROW()-4 -> 88 | B91: 五星 | C91: 张思添 | D91: 4.2366 | E91: 364.3476 | F91: 3049
A92: =ROW()-4 -> 89 | B92: 五星 | C92: 张标贤 | D92: 3.1602 | E92: 271.7772 | F92: 2987
A93: =ROW()-4 -> 90 | B93: 五星 | C93: 张进友 | D93: 4.9473 | E93: 425.4678 | F93: 3038
A94: =ROW()-4 -> 91 | B94: 五星 | C94: 张富添 | D94: 4.7472 | E94: 408.2592 | F94: 3050
A95: =ROW()-4 -> 92 | B95: 五星 | C95: 张亚兴 | D95: 5.0094 | E95: 430.8084 | F95: 0966
A96: =ROW()-4 -> 93 | B96: 五星 | C96: 张乐贤 | D96: 4.7403 | E96: 407.6658 | F96: 2976
A97: =ROW()-4 -> 94 | B97: 五星 | C97: 张关年 | D97: 1.4352 | E97: 123.4272 | F97: 3083
A98: =ROW()-4 -> 95 | B98: 五星 | C98: 张贵泉 | D98: 2.6082 | E98: 224.3052 | F98: 8054
A99: =ROW()-4 -> 96 | B99: 五星 | C99: 张国周 | D99: 2.47365 | E99: 212.7339 | F99: 9944
A100: =ROW()-4 -> 97 | B100: 五星 | C100: 张仲添 | D100: 2.47365 | E100: 212.7339 | F100: 8685
A101: =ROW()-4 -> 98 | B101: 向阳 | C101: 陈运华 | D101: 4.6851 | E101: 402.9186 | F101: 3935
A102: =ROW()-4 -> 99 | B102: 向阳 | C102: 陈展雄 | D102: 3.6294 | E102: 312.1284 | F102: 3968
A103: =ROW()-4 -> 100 | B103: 向阳 | C103: 陈运雄 | D103: 1.3524 | E103: 116.3064 | F103: 6700
A104: =ROW()-4 -> 101 | B104: 向阳 | C104: 陈叨雄 | D104: 1.6215 | E104: 139.449 | F104: 3871
A105: =ROW()-4 -> 102 | B105: 向阳 | C105: 陈想华 | D105: 1.6 | E105: 137.6 | F105: 3997
A106: =ROW()-4 -> 103 | B106: 向阳 | C106: 陈送文 | D106: 0.483 | E106: 41.538 | F106: 7647
A107: =ROW()-4 -> 104 | B107: 向阳 | C107: 陈景雄 | D107: 6.8517 | E107: 589.2462 | F107: 3957
A108: =ROW()-4 -> 105 | B108: 向阳 | C108: 陈志雄 | D108: 3.1809 | E108: 273.5574 | F108: 3719
A109: =ROW()-4 -> 106 | B109: 向阳 | C109: 陈少文 | D109: 2.8842 | E109: 248.0412 | F109: 8191
A110: =ROW()-4 -> 107 | B110: 向阳 | C110: 陈满友 | D110: 2.7876 | E110: 239.7336 | F110: 3753
A111: =ROW()-4 -> 108 | B111: 向阳 | C111: 陈运华 | D111: 3.4293 | E111: 294.9198 | F111: 3877
A112: =ROW()-4 -> 109 | B112: 向阳 | C112: 陈建雄 | D112: 4.5954 | E112: 395.2044 | F112: 3899
A113: =ROW()-4 -> 110 | B113: 向阳 | C113: 陈育雄 | D113: 3.1809 | E113: 273.5574 | F113: 1288
A114: =ROW()-4 -> 111 | B114: 向阳 | C114: 陈汉华 | D114: 2.001 | E114: 172.086 | F114: 3786
A115: =ROW()-4 -> 112 | B115: 向阳 | C115: 陈汉南 | D115: 1.8837 | E115: 161.9982 | F115: 9205
A116: =ROW()-4 -> 113 | B116: 向阳 | C116: 陈共华 | D116: 1.2489 | E116: 107.4054 | F116: 4581
A117: =ROW()-4 -> 114 | B117: 向阳 | C117: 陈育华 | D117: 1.2972 | E117: 111.5592 | F117: 0248
A118: =ROW()-4 -> 115 | B118: 向阳 | C118: 陈月英 | D118: 2.4771 | E118: 213.0306 | F118: 3913
A119: =ROW()-4 -> 116 | B119: 向阳 | C119: 陈运良 | D119: 1.9251 | E119: 165.5586 | F119: 6705
A120: =ROW()-4 -> 117 | B120: 向阳 | C120: 陈裕雄 | D120: 6.417 | E120: 551.862 | F120: 7717
A121: =ROW()-4 -> 118 | B121: 向阳 | C121: 张群英 | D121: 2.4909 | E121: 214.2174 | F121: 7510
A122: =ROW()-4 -> 119 | B122: 向阳 | C122: 陈南雄 | D122: 2.1735 | E122: 186.921 | F122: 8013
A123: =ROW()-4 -> 120 | B123: 向阳 | C123: 陈远雄 | D123: 3.4086 | E123: 293.1396 | F123: 7403
A124: =ROW()-4 -> 121 | B124: 向阳 | C124: 陈爱雄 | D124: 3.5604 | E124: 306.1944 | F124: 3819
A125: =ROW()-4 -> 122 | B125: 向阳 | C125: 陈井雄 | D125: 3.9537 | E125: 340.0182 | F125: 3720
A126: =ROW()-4 -> 123 | B126: 向阳 | C126: 张秀琴 | D126: 1.1868 | E126: 102.0648 | F126: 0509
A127: =ROW()-4 -> 124 | B127: 向阳 | C127: 陈万雄 | D127: 1.1454 | E127: 98.5044 | F127: 8209
A128: =ROW()-4 -> 125 | B128: 向阳 | C128: 陈美友 | D128: 1.8699 | E128: 160.8114 | F128: 3764
A129: =ROW()-4 -> 126 | B129: 向阳 | C129: 陈学华 | D129: 1.7112 | E129: 147.1632 | F129: 3811
A130: =ROW()-4 -> 127 | B130: 向阳 | C130: 陈申友 | D130: 2.3322 | E130: 200.5692 | F130: 3855
A131: =ROW()-4 -> 128 | B131: 向阳 | C131: 陈木泉 | D131: 1.449 | E131: 124.614 | F131: 3797
A132: =ROW()-4 -> 129 | B132: 向阳 | C132: 陈孟今 | D132: 3.8502 | E132: 331.1172 | F132: 2290
A133: =ROW()-4 -> 130 | B133: 向阳 | C133: 陈周泉 | D133: 1.1178 | E133: 96.1308 | F133: 3708
A134: =ROW()-4 -> 131 | B134: 向阳 | C134: 陈幼泉 | D134: 1.311 | E134: 112.746 | F134: 3800
A135: =ROW()-4 -> 132 | B135: 向阳 | C135: 陈茂华 | D135: 4.0779 | E135: 350.6994 | F135: 3822
A136: =ROW()-4 -> 133 | B136: 兴二 | C136: 张佳良 | D136: 3.5259 | E136: 303.2274 | F136: 0841
A137: =ROW()-4 -> 134 | B137: 兴二 | C137: 张友添 | D137: 1.725 | E137: 148.35 | F137: 2284
A138: =ROW()-4 -> 135 | B138: 兴二 | C138: 张新贤 | D138: 3.6294 | E138: 312.1284 | F138: 2273
A139: =ROW()-4 -> 136 | B139: 兴二 | C139: 张小龙 | D139: 3.2568 | E139: 280.0848 | F139: 3958
A140: =ROW()-4 -> 137 | B140: 兴二 | C140: 张远泉 | D140: 2.7738 | E140: 238.5468 | F140: 2382
A141: =ROW()-4 -> 138 | B141: 兴二 | C141: 张且乃 | D141: 1.4835 | E141: 127.581 | F141: 2386
A142: =ROW()-4 -> 139 | B142: 兴二 | C142: 张纪添 | D142: 8.211 | E142: 706.146 | F142: 2295
A143: =ROW()-4 -> 140 | B143: 兴二 | C143: 张焕权 | D143: 1.8699 | E143: 160.8114 | F143: 7528
A144: =ROW()-4 -> 141 | B144: 兴二 | C144: 张跃权 | D144: 3.5535 | E144: 305.601 | F144: 2171
A145: =ROW()-4 -> 142 | B145: 兴二 | C145: 陈连娣 | D145: 3.3465 | E145: 287.799 | F145: 2331
A146: =ROW()-4 -> 143 | B146: 兴二 | C146: 张秀英 | D146: 3.795 | E146: 326.37 | F146: 2375
A147: =ROW()-4 -> 144 | B147: 兴二 | C147: 张幼兰 | D147: 3.8226 | E147: 328.7436 | F147: 2353
A148: =ROW()-4 -> 145 | B148: 兴二 | C148: 张文胜 | D148: 3.1878 | E148: 274.1508 | F148: 2397
A149: =ROW()-4 -> 146 | B149: 兴二 | C149: 张运添 | D149: 2.5185 | E149: 216.591 | F149: 2228
A150: =ROW()-4 -> 147 | B150: 兴二 | C150: 张跃文 | D150: 10.3431 | E150: 889.5066 | F150: 2251
A151: =ROW()-4 -> 148 | B151: 兴二 | C151: 张仁添 | D151: 2.2494 | E151: 193.4484 | F151: 2320
A152: =ROW()-4 -> 149 | B152: 兴二 | C152: 张国添 | D152: 3.8709 | E152: 332.8974 | F152: 2240
A153: =ROW()-4 -> 150 | B153: 兴二 | C153: 张运华 | D153: 3.7467 | E153: 322.2162 | F153: 2239
A154: =ROW()-4 -> 151 | B154: 兴二 | C154: 张锦玉 | D154: 4.6161 | E154: 396.9846 | F154: 1493
A155: =ROW()-4 -> 152 | B155: 兴二 | C155: 张文锋 | D155: 1.7802 | E155: 153.0972 | F155: 7667
A156: =ROW()-4 -> 153 | B156: 兴二 | C156: 张关元 | D156: 3.1188 | E156: 268.2168 | F156: 2411
A157: =ROW()-4 -> 154 | B157: 兴二 | C157: 张新华 | D157: 4.1745 | E157: 359.007 | F157: 8134
A158: =ROW()-4 -> 155 | B158: 兴二 | C158: 张关胜 | D158: 2.4288 | E158: 208.8768 | F158: 5349
A159: =ROW()-4 -> 156 | B159: 兴二 | C159: 张且宁 | D159: 3.1878 | E159: 274.1508 | F159: 2308
A160: =ROW()-4 -> 157 | B160: 兴二 | C160: 张伟华 | D160: 3.8226 | E160: 328.7436 | F160: 0585
A161: =ROW()-4 -> 158 | B161: 兴二 | C161: 张育南 | D161: 3.6984 | E161: 318.0624 | F161: 2342
A162: =ROW()-4 -> 159 | B162: 兴二 | C162: 张远洪 | D162: 4.4091 | E162: 379.1826 | F162: 8548
A163: =ROW()-4 -> 160 | B163: 兴二 | C163: 张访新 | D163: 3.8709 | E163: 332.8974 | F163: 8597
A164: =ROW()-4 -> 161 | B164: 兴一 | C164: 张金标 | D164: 7.2519 | E164: 623.6634 | F164: 8770
A165: =ROW()-4 -> 162 | B165: 兴一 | C165: 张木华 | D165: 4.6989 | E165: 404.1054 | F165: 2625
A166: =ROW()-4 -> 163 | B166: 兴一 | C166: 陈月香 | D166: 4.2228 | E166: 363.1608 | F166: 2466
A167: =ROW()-4 -> 164 | B167: 兴一 | C167: 张华亮 | D167: 3.5397 | E167: 304.4142 | F167: 1485
A168: =ROW()-4 -> 165 | B168: 兴一 | C168: 张贵贤 | D168: 2.1597 | E168: 185.7342 | F168: 2647
A169: =ROW()-4 -> 166 | B169: 兴一 | C169: 张锡贤 | D169: 4.0641 | E169: 349.5126 | F169: 2603
A170: =ROW()-4 -> 167 | B170: 兴一 | C170: 张辛添 | D170: 2.9325 | E170: 252.195 | F170: 9886
A171: =ROW()-4 -> 168 | B171: 兴一 | C171: 张俊贤 | D171: 2.5461 | E171: 218.9646 | F171: 2658
A172: =ROW()-4 -> 169 | B172: 兴一 | C172: 张吉友 | D172: 4.5126 | E172: 388.0836 | F172: 2591
A173: =ROW()-4 -> 170 | B173: 兴一 | C173: 张法添 | D173: 1.2558 | E173: 107.9988 | F173: 2433
A174: =ROW()-4 -> 171 | B174: 兴一 | C174: 张爱贤 | D174: 5.6097 | E174: 482.4342 | F174: 2524
A175: =ROW()-4 -> 172 | B175: 兴一 | C175: 张法良 | D175: 1.1592 | E175: 99.6912 | F175: 8936
A176: =ROW()-4 -> 173 | B176: 兴一 | C176: 张法道 | D176: 1.5387 | E176: 132.3282 | F176: 0863
A177: =ROW()-4 -> 174 | B177: 兴一 | C177: 张胜添 | D177: 5.1612 | E177: 443.8632 | F177: 7716
A178: =ROW()-4 -> 175 | B178: 兴一 | C178: 张伟南 | D178: 2.3184 | E178: 199.3824 | F178: 2546
A179: =ROW()-4 -> 176 | B179: 兴一 | C179: 张法尚 | D179: 2.691 | E179: 231.426 | F179: 2499
A180: =ROW()-4 -> 177 | B180: 兴一 | C180: 张作贤 | D180: 2.07 | E180: 178.02 | F180: 8332
A181: =ROW()-4 -> 178 | B181: 兴一 | C181: 张清泉 | D181: 1.4352 | E181: 123.4272 | F181: 0593
A182: =ROW()-4 -> 179 | B182: 兴一 | C182: 张法亮 | D182: 3.4845 | E182: 299.667 | F182: 2502
A183: =ROW()-4 -> 180 | B183: 兴一 | C183: 张均泉 | D183: 1.8975 | E183: 163.185 | F183: 5146
A184: =ROW()-4 -> 181 | B184: 兴一 | C184: 张职南 | D184: 3.9744 | E184: 341.7984 | F184: 2535
A185: =ROW()-4 -> 182 | B185: 兴一 | C185: 张银泉 | D185: 1.6215 | E185: 139.449 | F185: 7536
A186: =ROW()-4 -> 183 | B186: 兴一 | C186: 张紧泉 | D186: 1.2972 | E186: 111.5592 | F186: 8654
A187: =ROW()-4 -> 184 | B187: 兴一 | C187: 张亚伟 | D187: 3.726 | E187: 320.436 | F187: 2636
A188: =ROW()-4 -> 185 | B188: 兴一 | C188: 张锡坤 | D188: 1.0902 | E188: 93.7572 | F188: 9477
A189: =ROW()-4 -> 186 | B189: 兴一 | C189: 张清古 | D189: 2.691 | E189: 231.426 | F189: 2408
A190: =ROW()-4 -> 187 | B190: 永星 | C190: 陈付才 | D190: 3.9054 | E190: 335.8644 | F190: 3594
A191: =ROW()-4 -> 188 | B191: 永星 | C191: 陈亚石 | D191: 2.2977 | E191: 197.6022 | F191: 9928
A192: =ROW()-4 -> 189 | B192: 永星 | C192: 陈幼文 | D192: 2.1804 | E192: 187.5144 | F192: 1673
A193: =ROW()-4 -> 190 | B193: 永星 | C193: 朱新娣 | D193: 1.6974 | E193: 145.9764 | F193: 2710
A194: =ROW()-4 -> 191 | B194: 永星 | C194: 陈丽娟 | D194: 4.2228 | E194: 363.1608 | F194: 9663
A195: =ROW()-4 -> 192 | B195: 永星 | C195: 陈法均 | D195: 5.5476 | E195: 477.0936 | F195: 3640
A196: =ROW()-4 -> 193 | B196: 永星 | C196: 陈且玉 | D196: 4.2366 | E196: 364.3476 | F196: 3662
A197: =ROW()-4 -> 194 | B197: 永星 | C197: 陈幼南 | D197: 1.9872 | E197: 170.8992 | F197: 7136
A198: =ROW()-4 -> 195 | B198: 永星 | C198: 陈茂方 | D198: 3.9882 | E198: 342.9852 | F198: 5942
A199: =ROW()-4 -> 196 | B199: 永星 | C199: 陈炎洲 | D199: 5.1198 | E199: 440.3028 | F199: 8092
A200: =ROW()-4 -> 197 | B200: 永星 | C200: 陈楚乃 | D200: 5.8098 | E200: 499.6428 | F200: 1055
A201: =ROW()-4 -> 198 | B201: 永星 | C201: 陈镜明 | D201: 2.3046 | E201: 198.1956 | F201: 9828
A202: =ROW()-4 -> 199 | B202: 永星 | C202: 陈水文 | D202: 4.692 | E202: 403.512 | F202: 3617
A203: =ROW()-4 -> 200 | B203: 永星 | C203: 陈水今 | D203: 4.3056 | E203: 370.2816 | F203: 9841
A204: =ROW()-4 -> 201 | B204: 永星 | C204: 陈坤良 | D204: 4.968 | E204: 427.248 | F204: 8894
A205: =ROW()-4 -> 202 | B205: 永星 | C205: 陈彩权 | D205: 2.2149 | E205: 190.4814 | F205: 9902
A206: =ROW()-4 -> 203 | B206: 永星 | C206: 陈灼华 | D206: 7.107 | E206: 611.202 | F206: 6686
A207: =ROW()-4 -> 204 | B207: 永星 | C207: 陈水清 | D207: 5.3958 | E207: 464.0388 | F207: 3628
A208: =ROW()-4 -> 205 | B208: 永星 | C208: 陈远贵 | D208: 1.9113 | E208: 164.3718 | F208: 2579
A209: =ROW()-4 -> 206 | B209: 永星 | C209: 陈石浪 | D209: 3.5121 | E209: 302.0406 | F209: 7547
A210: =ROW()-4 -> 207 | B210: 永星 | C210: 陈其方 | D210: 2.2011 | E210: 189.2946 | F210: 3684