A1: 平头
A2: 平空 | B2: 0.8 | C2: 1 | D2: 1.2 | E2: 1.4 | F2: 1.6 | G2: 2 | H2: 2.5 | I2: 3 | J2: 3.5 | K2: 4 | L2: 5 | M2: 6 | N2: 8 | O2: 10
A3: 帽径 | B3: 2 | C3: 1.6 | D3: 2.2 | E3: 2.5 | F3: 3 | G3: 3.5 | H3: 4.5 | I3: 5.5 | J3: 6.5 | K3: 7.5 | L3: 9.5 | M3: 11.5 | N3: 15.5 | O3: 19
A4: 公差 | D4: 0.2 | E4: 0.2 | F4: 0.2 | G4: 0.24 | H4: 0.24 | I4: 0.24 | J4: 0.29 | K4: 0.29 | L4: 0.28999999999999898 | M4: 0.35 | N4: 0.35 | O4: 0.42000000000000198
A5: 杆径 | B5: 0.8 | C5: 1 | D5: 1.2 | E5: 1.4 | F5: 1.6 | G5: 2 | H5: 2.5 | I5: 3 | J5: 3.5 | K5: 4 | L5: 5 | M5: 6 | N5: 8 | O5: 10
A6: 公差 | D6: 6.0000000000000102e-002 | E6: 6.0000000000000102e-002 | F6: 5.9999999999999797e-002 | G6: 6.0000000000000102e-002 | H6: 6.0000000000000102e-002 | I6: 6.0000000000000102e-002 | J6: 8.0000000000000099e-002 | K6: 8.0000000000000099e-002 | L6: 8.0000000000000099e-002 | M6: 8.0000000000000099e-002 | N6: 9.9999999999999603e-002 | O6: 9.9999999999999603e-002
A7: 杆长 | B7: 杆长 | C7: 杆长 | D7: 杆长 | E7: 杆长 | F7: 杆长 | G7: 杆长 | H7: 杆长 | I7: 杆长 | J7: 杆长 | K7: 杆长 | L7: 杆长 | M7: 杆长 | N7: 杆长 | O7: 杆长
A8: 帽厚 | B8: 0.5 | C8: 0.5 | D8: 0.5 | E8: 0.5 | F8: 0.5 | G8: 0.6 | H8: 0.6 | I8: 0.8 | J8: 0.8 | K8: 1 | L8: 1 | M8: 1.2 | N8: 1.2 | O8: 1.5
A9: 公差 | D9: 0.08 | E9: 0.08 | F9: 0.08 | G9: 0.08 | H9: 0.08 | I9: 0.08 | J9: 0.08 | K9: 0.13 | L9: 0.13 | M9: 0.13 | N9: 0.13 | O9: 0.13
A10: 孔径 | C10: 0.7 | D10: 0.6-0.7 | E10: 1 | F10: 1 | G10: 1.4 | H10: 1.8 | I10: 2.3 | J10: 2.6 | K10: 3.2 | L10: 3.9 | M10: 4.9 | N10: 6.5 | O10: 8.5
A11: 孔深 | C11: 1 | D11: 1.2 | E11: 1.4 | F11: 1.6 | G11: 2 | H11: 2.5 | I11: 3 | J11: 3.5 | K11: 4 | L11: 5 | M11: 6 | N11: 8 | O11: 10
A12: 公差 | D12: 0.24 | E12: 0.24 | F12: 0.24 | G12: 0.24 | H12: 0.24 | I12: 0.24 | J12: 0.29 | K12: 0.29 | L12: 0.29 | M12: 0.29 | N12: 0.35 | O12: 0.35
A13: 壁厚 | B13: =(B5-B10)/2 -> 0.4 | D13: =(D5-0.6)/2 -> 0.3 | E13: =(E5-E10)/2 -> 0.2 | F13: =(F5-F10)/2 -> 0.3 | G13: =(G5-G10)/2 -> 0.3 | H13: =(H5-H10)/2 -> 0.35 | I13: =(I5-I10)/2 -> 0.35 | J13: =(J5-J10)/2 -> 0.45 | K13: =(K5-K10)/2 -> 0.4 | L13: =(L5-L10)/2 -> 0.55 | M13: =(M5-M10)/2 -> 0.55 | N13: =(N5-N10)/2 -> 0.75 | O13: =(O5-O10)/2 -> 0.75
A14: 圆头
A15: 圆空 | B15: 0.8 | C15: 1 | D15: 1.2 | E15: 1.4 | F15: 1.6 | G15: 2 | H15: 2.5 | I15: 3 | J15: 3.5 | K15: 4 | L15: 5 | M15: 6 | N15: 8 | O15: 10
A16: 帽径 | B16: 2 | C16: 1.6 | D16: 2.4 | E16: 2.8 | F16: 3.2 | G16: 4 | H16: 5 | I16: 6 | J16: 7 | K16: 8 | L16: 10 | M16: 12 | N16: 16 | O16: 20
A17: 公差 | D17: 0.2 | E17: 0.2 | F17: 0.24 | G17: 0.24 | H17: 0.24 | I17: 0.24 | J17: 0.29 | K17: 0.28999999999999898 | L17: 0.28999999999999898 | M17: 0.35 | N17: 0.35000000000000098 | O17: 0.42000000000000198
A18: 杆径 | B18: 0.8 | C18: 1 | D18: 1.2 | E18: 1.4 | F18: 1.6 | G18: 2 | H18: 2.5 | I18: 3 | J18: 3.5 | K18: 4 | L18: 5 | M18: 6 | N18: 8 | O18: 10
A19: 公差 | D19: 6.0000000000000102e-002 | E19: 6.0000000000000102e-002 | F19: 5.9999999999999797e-002 | G19: 6.0000000000000102e-002 | H19: 6.0000000000000102e-002 | I19: 6.0000000000000102e-002 | J19: 8.0000000000000099e-002 | K19: 8.0000000000000099e-002 | L19: 8.0000000000000099e-002 | M19: 8.0000000000000099e-002 | N19: 9.9999999999999603e-002 | O19: 9.9999999999999603e-002
A20: 杆长 | B20: 杆长 | C20: 杆长 | D20: 杆长 | E20: 杆长 | F20: 杆长 | G20: 杆长 | H20: 杆长 | I20: 杆长 | J20: 杆长 | K20: 杆长 | L20: 杆长 | M20: 杆长 | N20: 杆长 | O20: 杆长
A21: 帽厚 | B21: 0.5 | C21: 0.6 | D21: 0.5 | E21: 0.6 | F21: 0.7 | G21: 0.8 | H21: 0.8 | I21: 1 | J21: 1.2 | K21: 1.3 | L21: 1.7 | M21: 2.2 | N21: 3 | O21: 4
A22: 公差 | D22: 0.1 | E22: 0.1 | F22: 0.1 | G22: 0.1 | H22: 0.1 | I22: 0.2 | J22: 0.2 | K22: 0.2 | L22: 0.2 | M22: 0.2 | N22: 0.2 | O22: 0.24
A23: 孔径 | C23: 0.7 | D23: 0.6-0.7 | E23: 1 | F23: 1 | G23: 1.4 | H23: 1.8 | I23: 2.3 | J23: 2.6 | K23: 3.2 | L23: 3.9 | M23: 4.9 | N23: 6.5 | O23: 8.5
A24: 孔深 | C24: 1 | D24: 1.2 | E24: 1.4 | F24: 1.6 | G24: 2 | H24: 2.5 | I24: 3 | J24: 3.5 | K24: 4 | L24: 5 | M24: 6 | N24: 8 | O24: 10
A25: 公差 | D25: 0.24 | E25: 0.24 | F25: 0.24 | G25: 0.24 | H25: 0.24 | I25: 0.24 | J25: 0.29 | K25: 0.29 | L25: 0.29 | M25: 0.29 | N25: 0.35 | O25: 0.35
A26: 壁厚 | B26: =(B18-B23)/2 -> 0.4 | D26: =(D18-0.6)/2 -> 0.3 | E26: =(E18-E23)/2 -> 0.2 | F26: =(F18-F23)/2 -> 0.3 | G26: =(G18-G23)/2 -> 0.3 | H26: =(H18-H23)/2 -> 0.35 | I26: =(I18-I23)/2 -> 0.35 | J26: =(J18-J23)/2 -> 0.45 | K26: =(K18-K23)/2 -> 0.4 | L26: =(L18-L23)/2 -> 0.55 | M26: =(M18-M23)/2 -> 0.55 | N26: =(N18-N23)/2 -> 0.75 | O26: =(O18-O23)/2 -> 0.75
A27: 子母铆钉
A28: 子母 | B28: 1.9 | D28: 2 | E28: 2 | F28: 2.5 | G28: 3 | H28: 4 | I28: 4 | J28: 4 | K28: 5 | L28: 5 | M28: 5 | N28: 6
A29: 帽径 | B29: 3.2 | D29: 3.2 | E29: 3 | F29: 3.5 | G29: 5 | H29: 7 | I29: 7 | J29: 7 | K29: 8 | L29: 8 | M29: 8 | N29: 10
A30: 杆径 | B30: 1.9 | D30: 2 | E30: 2 | F30: 2.5 | G30: 3 | H30: 4 | I30: 4 | J30: 4 | K30: 5 | L30: 5 | M30: 5 | N30: 6
A31: 杆长 | B31: 杆长 | D31: 杆长 | E31: 杆长 | F31: 杆长 | G31: 杆长 | H31: 杆长 | I31: 杆长 | J31: 杆长 | K31: 杆长 | L31: 杆长 | M31: 杆长 | N31: 杆长
A32: 帽厚 | B32: 0.9 | D32: 0.9 | E32: 0.9 | F32: 1 | G32: 1.1 | H32: 1.3 | I32: 1.2 | J32: 1.2 | K32: 1.7 | L32: 1.5 | M32: 1 | N32: 1.8
A33: 杆径 | B33: 1.43 | D33: 1.43 | E33: 1.4 | F33: 1.75 | G33: 2.18 | H33: 3 | I33: 3 | J33: 3 | K33: 3.96 | L33: 4 | M33: 3.44 | N33: 4.7
A34: 杆长 | B34: 3 | D34: 3 | E34: 3 | F34: 3.5 | G34: 4 | H34: 4.5 | I34: 4 | J34: 13 | K34: 6.5 | L34: 4.5 | M34: 13 | N34: 6.5
A35: 孔径 | B35: 1.35 | D35: 1.35 | E35: 1.38 | F35: 1.64 | G35: 2.12 | H35: 2.95 | I35: 2.92 | J35: 2.92 | K35: 3.9 | L35: 3.95 | M35: 3.41
A36: 孔深 | B36: 3.2 | D36: 3.2 | E36: 3.3 | F36: 3.85 | G36: 4.7 | H36: 4.5 | I36: 4.5 | J36: 13.5 | K36: 6.7 | L36: 4.5 | M36: 13.7 | N36: 7.3
A37: 沉头
A38: 沉头 | B38: 1.4 | D38: 1.6 | E38: 2 | F38: 2.5 | G38: 3 | H38: 3 | I38: 3 | J38: 4 | K38: 4.95 | L38: 5 | M38: 5.9 | N38: 6 | O38: 6
A39: 帽径 | B39: 2.7 | D39: 2.9 | E39: 4 | F39: 5.2 | G39: 6.1 | H39: 5.2 | I39: 5.7 | J39: 7 | K39: 8 | L39: 8.8 | M39: 11 | N39: 11.3 | O39: 10
A40: 杆径 | B40: 1.4 | D40: =D38 -> 1.6 | E40: =E38 -> 2 | F40: =F38 -> 2.5 | G40: =G38 -> 3 | H40: =H38 -> 3 | I40: =I38 -> 3 | J40: =J38 -> 4 | K40: =K38 -> 4.95 | L40: =L38 -> 5 | M40: =M38 -> 5.9 | N40: =N38 -> 6 | O40: =O38 -> 6
A41: 杆长 | B41: 杆长 | D41: 杆长 | E41: 杆长 | F41: 杆长 | G41: 杆长 | H41: 杆长 | I41: 杆长 | J41: 杆长 | K41: 杆长 | L41: 杆长 | M41: 杆长 | N41: 杆长 | O41: 杆长
A42: 帽厚 | B42: 0.7 | D42: 0.7 | E42: 1.1 | F42: 0.9 | G42: 1 | H42: 1.2 | I42: 1.7 | J42: 1.6 | K42: 1.8 | L42: 2 | M42: 3 | N42: 1.8 | O42: 3
A43: 沉头
A44: 沉头 | B44: 5 | D44: 1.8 | E44: 2 | F44: 2.5 | G44: 3.5 | H44: 1.33 | I44: 5.95
A45: 帽径 | B45: 6.5 | D45: 3 | E45: 3.8 | F45: 4.5 | G45: 6 | H45: 2.5 | I45: 11.25
A46: 杆径 | B46: =B44 -> 5 | D46: =D44 -> 1.8 | E46: =E44 -> 2 | F46: =F44 -> 2.5 | G46: =G44 -> 3.5 | H46: =H44 -> 1.33 | I46: =I44 -> 5.95 | J46: =J44 -> 0 | K46: =K44 -> 0 | L46: =L44 -> 0 | M46: =M44 -> 0 | N46: =N44 -> 0 | O46: =O44 -> 0
A47: 杆长 | B47: 杆长 | D47: 杆长 | E47: 杆长 | F47: 杆长 | G47: 杆长 | H47: 杆长 | I47: 杆长 | J47: 杆长 | K47: 杆长 | L47: 杆长 | M47: 杆长 | N47: 杆长 | O47: 杆长
A48: 帽厚 | B48: 0.6 | D48: 0.6-0.7 | E48: 1 | F48: 1.2 | G48: 1.5 | H48: 0.7 | I48: 1.9