B1: 2025 | D1: 年 | E1: 1 | F1: 月
A2: 星期日 | B2: 星期一 | C2: 星期二 | D2: 星期三 | E2: 星期四 | F2: 星期五 | G2: 星期六
A3: =DATE(B1,E1,2)-WEEKDAY(DATE(B1,E1,1),1) -> 45655. | B3: =A3+1 -> 45656. | C3: =B3+1 -> 45657. | D3: =C3+1 -> 45658. | E3: =D3+1 -> 45659. | F3: =E3+1 -> 45660. | G3: =F3+1 -> 45661.
A4: =G3+1 -> 45662. | B4: =A4+1 -> 45663. | C4: =B4+1 -> 45664. | D4: =C4+1 -> 45665. | E4: =D4+1 -> 45666. | F4: =E4+1 -> 45667. | G4: =F4+1 -> 45668.
A5: =G4+1 -> 45669. | B5: =A5+1 -> 45670. | C5: =B5+1 -> 45671. | D5: =C5+1 -> 45672. | E5: =D5+1 -> 45673. | F5: =E5+1 -> 45674. | G5: =F5+1 -> 45675.
A6: =G5+1 -> 45676. | B6: =A6+1 -> 45677. | C6: =B6+1 -> 45678. | D6: =C6+1 -> 45679. | E6: =D6+1 -> 45680. | F6: =E6+1 -> 45681. | G6: =F6+1 -> 45682.
A7: =G6+1 -> 45683. | B7: =A7+1 -> 45684. | C7: =B7+1 -> 45685. | D7: =C7+1 -> 45686. | E7: =D7+1 -> 45687. | F7: =E7+1 -> 45688. | G7: =F7+1 -> 45689.
A8: =G7+1 -> 45690. | B8: =A8+1 -> 45691. | C8: =B8+1 -> 45692. | D8: =C8+1 -> 45693. | E8: =D8+1 -> 45694. | F8: =E8+1 -> 45695. | G8: =F8+1 -> 45696.
B10: =B1 -> 2025 | D10: 年 | E10: =E1+1 -> 2 | F10: 月
A11: 星期日 | B11: 星期一 | C11: 星期二 | D11: 星期三 | E11: 星期四 | F11: 星期五 | G11: 星期六
A12: =DATE(B10,E10,2)-WEEKDAY(DATE(B10,E10,1),1) -> 45683. | B12: =A12+1 -> 45684. | C12: =B12+1 -> 45685. | D12: =C12+1 -> 45686. | E12: =D12+1 -> 45687. | F12: =E12+1 -> 45688. | G12: =F12+1 -> 45689.
A13: =G12+1 -> 45690. | B13: =A13+1 -> 45691. | C13: =B13+1 -> 45692. | D13: =C13+1 -> 45693. | E13: =D13+1 -> 45694. | F13: =E13+1 -> 45695. | G13: =F13+1 -> 45696.
A14: =G13+1 -> 45697. | B14: =A14+1 -> 45698. | C14: =B14+1 -> 45699. | D14: =C14+1 -> 45700. | E14: =D14+1 -> 45701. | F14: =E14+1 -> 45702. | G14: =F14+1 -> 45703.
A15: =G14+1 -> 45704. | B15: =A15+1 -> 45705. | C15: =B15+1 -> 45706. | D15: =C15+1 -> 45707. | E15: =D15+1 -> 45708. | F15: =E15+1 -> 45709. | G15: =F15+1 -> 45710.
A16: =G15+1 -> 45711. | B16: =A16+1 -> 45712. | C16: =B16+1 -> 45713. | D16: =C16+1 -> 45714. | E16: =D16+1 -> 45715. | F16: =E16+1 -> 45716. | G16: =F16+1 -> 45717.
A17: =G16+1 -> 45718. | B17: =A17+1 -> 45719. | C17: =B17+1 -> 45720. | D17: =C17+1 -> 45721. | E17: =D17+1 -> 45722. | F17: =E17+1 -> 45723. | G17: =F17+1 -> 45724.
B19: =B10 -> 2025 | D19: 年 | E19: =E10+1 -> 3 | F19: 月
A20: 星期日 | B20: 星期一 | C20: 星期二 | D20: 星期三 | E20: 星期四 | F20: 星期五 | G20: 星期六
A21: =DATE(B19,E19,2)-WEEKDAY(DATE(B19,E19,1),1) -> 45711. | B21: =A21+1 -> 45712. | C21: =B21+1 -> 45713. | D21: =C21+1 -> 45714. | E21: =D21+1 -> 45715. | F21: =E21+1 -> 45716. | G21: =F21+1 -> 45717.
A22: =G21+1 -> 45718. | B22: =A22+1 -> 45719. | C22: =B22+1 -> 45720. | D22: =C22+1 -> 45721. | E22: =D22+1 -> 45722. | F22: =E22+1 -> 45723. | G22: =F22+1 -> 45724.
A23: =G22+1 -> 45725. | B23: =A23+1 -> 45726. | C23: =B23+1 -> 45727. | D23: =C23+1 -> 45728. | E23: =D23+1 -> 45729. | F23: =E23+1 -> 45730. | G23: =F23+1 -> 45731.
A24: =G23+1 -> 45732. | B24: =A24+1 -> 45733. | C24: =B24+1 -> 45734. | D24: =C24+1 -> 45735. | E24: =D24+1 -> 45736. | F24: =E24+1 -> 45737. | G24: =F24+1 -> 45738.
A25: =G24+1 -> 45739. | B25: =A25+1 -> 45740. | C25: =B25+1 -> 45741. | D25: =C25+1 -> 45742. | E25: =D25+1 -> 45743. | F25: =E25+1 -> 45744. | G25: =F25+1 -> 45745.
A26: =G25+1 -> 45746. | B26: =A26+1 -> 45747. | C26: =B26+1 -> 45748. | D26: =C26+1 -> 45749. | E26: =D26+1 -> 45750. | F26: =E26+1 -> 45751. | G26: =F26+1 -> 45752.
B28: =B19 -> 2025 | D28: 年 | E28: =E19+1 -> 4 | F28: 月
A29: 星期日 | B29: 星期一 | C29: 星期二 | D29: 星期三 | E29: 星期四 | F29: 星期五 | G29: 星期六
A30: =DATE(B28,E28,2)-WEEKDAY(DATE(B28,E28,1),1) -> 45746. | B30: =A30+1 -> 45747. | C30: =B30+1 -> 45748. | D30: =C30+1 -> 45749. | E30: =D30+1 -> 45750. | F30: =E30+1 -> 45751. | G30: =F30+1 -> 45752.
A31: =G30+1 -> 45753. | B31: =A31+1 -> 45754. | C31: =B31+1 -> 45755. | D31: =C31+1 -> 45756. | E31: =D31+1 -> 45757. | F31: =E31+1 -> 45758. | G31: =F31+1 -> 45759.
A32: =G31+1 -> 45760. | B32: =A32+1 -> 45761. | C32: =B32+1 -> 45762. | D32: =C32+1 -> 45763. | E32: =D32+1 -> 45764. | F32: =E32+1 -> 45765. | G32: =F32+1 -> 45766.
A33: =G32+1 -> 45767. | B33: =A33+1 -> 45768. | C33: =B33+1 -> 45769. | D33: =C33+1 -> 45770. | E33: =D33+1 -> 45771. | F33: =E33+1 -> 45772. | G33: =F33+1 -> 45773.
A34: =G33+1 -> 45774. | B34: =A34+1 -> 45775. | C34: =B34+1 -> 45776. | D34: =C34+1 -> 45777. | E34: =D34+1 -> 45778. | F34: =E34+1 -> 45779. | G34: =F34+1 -> 45780.
A35: =G34+1 -> 45781. | B35: =A35+1 -> 45782. | C35: =B35+1 -> 45783. | D35: =C35+1 -> 45784. | E35: =D35+1 -> 45785. | F35: =E35+1 -> 45786. | G35: =F35+1 -> 45787.
B37: =B28 -> 2025 | D37: 年 | E37: =E28+1 -> 5 | F37: 月
A38: 星期日 | B38: 星期一 | C38: 星期二 | D38: 星期三 | E38: 星期四 | F38: 星期五 | G38: 星期六
A39: =DATE(B37,E37,2)-WEEKDAY(DATE(B37,E37,1),1) -> 45774. | B39: =A39+1 -> 45775. | C39: =B39+1 -> 45776. | D39: =C39+1 -> 45777. | E39: =D39+1 -> 45778. | F39: =E39+1 -> 45779. | G39: =F39+1 -> 45780.
A40: =G39+1 -> 45781. | B40: =A40+1 -> 45782. | C40: =B40+1 -> 45783. | D40: =C40+1 -> 45784. | E40: =D40+1 -> 45785. | F40: =E40+1 -> 45786. | G40: =F40+1 -> 45787.
A41: =G40+1 -> 45788. | B41: =A41+1 -> 45789. | C41: =B41+1 -> 45790. | D41: =C41+1 -> 45791. | E41: =D41+1 -> 45792. | F41: =E41+1 -> 45793. | G41: =F41+1 -> 45794.
A42: =G41+1 -> 45795. | B42: =A42+1 -> 45796. | C42: =B42+1 -> 45797. | D42: =C42+1 -> 45798. | E42: =D42+1 -> 45799. | F42: =E42+1 -> 45800. | G42: =F42+1 -> 45801.
A43: =G42+1 -> 45802. | B43: =A43+1 -> 45803. | C43: =B43+1 -> 45804. | D43: =C43+1 -> 45805. | E43: =D43+1 -> 45806. | F43: =E43+1 -> 45807. | G43: =F43+1 -> 45808.
A44: =G43+1 -> 45809. | B44: =A44+1 -> 45810. | C44: =B44+1 -> 45811. | D44: =C44+1 -> 45812. | E44: =D44+1 -> 45813. | F44: =E44+1 -> 45814. | G44: =F44+1 -> 45815.
B46: =B37 -> 2025 | D46: 年 | E46: =E37+1 -> 6 | F46: 月
A47: 星期日 | B47: 星期一 | C47: 星期二 | D47: 星期三 | E47: 星期四 | F47: 星期五 | G47: 星期六
A48: =DATE(B46,E46,2)-WEEKDAY(DATE(B46,E46,1),1) -> 45809. | B48: =A48+1 -> 45810. | C48: =B48+1 -> 45811. | D48: =C48+1 -> 45812. | E48: =D48+1 -> 45813. | F48: =E48+1 -> 45814. | G48: =F48+1 -> 45815.
A49: =G48+1 -> 45816. | B49: =A49+1 -> 45817. | C49: =B49+1 -> 45818. | D49: =C49+1 -> 45819. | E49: =D49+1 -> 45820. | F49: =E49+1 -> 45821. | G49: =F49+1 -> 45822.
A50: =G49+1 -> 45823. | B50: =A50+1 -> 45824. | C50: =B50+1 -> 45825. | D50: =C50+1 -> 45826. | E50: =D50+1 -> 45827. | F50: =E50+1 -> 45828. | G50: =F50+1 -> 45829.
A51: =G50+1 -> 45830. | B51: =A51+1 -> 45831. | C51: =B51+1 -> 45832. | D51: =C51+1 -> 45833. | E51: =D51+1 -> 45834. | F51: =E51+1 -> 45835. | G51: =F51+1 -> 45836.
A52: =G51+1 -> 45837. | B52: =A52+1 -> 45838. | C52: =B52+1 -> 45839. | D52: =C52+1 -> 45840. | E52: =D52+1 -> 45841. | F52: =E52+1 -> 45842. | G52: =F52+1 -> 45843.
A53: =G52+1 -> 45844. | B53: =A53+1 -> 45845. | C53: =B53+1 -> 45846. | D53: =C53+1 -> 45847. | E53: =D53+1 -> 45848. | F53: =E53+1 -> 45849. | G53: =F53+1 -> 45850.
B55: =B46 -> 2025 | D55: 年 | E55: =E46+1 -> 7 | F55: 月
A56: 星期日 | B56: 星期一 | C56: 星期二 | D56: 星期三 | E56: 星期四 | F56: 星期五 | G56: 星期六
A57: =DATE(B55,E55,2)-WEEKDAY(DATE(B55,E55,1),1) -> 45837. | B57: =A57+1 -> 45838. | C57: =B57+1 -> 45839. | D57: =C57+1 -> 45840. | E57: =D57+1 -> 45841. | F57: =E57+1 -> 45842. | G57: =F57+1 -> 45843.
A58: =G57+1 -> 45844. | B58: =A58+1 -> 45845. | C58: =B58+1 -> 45846. | D58: =C58+1 -> 45847. | E58: =D58+1 -> 45848. | F58: =E58+1 -> 45849. | G58: =F58+1 -> 45850.
A59: =G58+1 -> 45851. | B59: =A59+1 -> 45852. | C59: =B59+1 -> 45853. | D59: =C59+1 -> 45854. | E59: =D59+1 -> 45855. | F59: =E59+1 -> 45856. | G59: =F59+1 -> 45857.
A60: =G59+1 -> 45858. | B60: =A60+1 -> 45859. | C60: =B60+1 -> 45860. | D60: =C60+1 -> 45861. | E60: =D60+1 -> 45862. | F60: =E60+1 -> 45863. | G60: =F60+1 -> 45864.
A61: =G60+1 -> 45865. | B61: =A61+1 -> 45866. | C61: =B61+1 -> 45867. | D61: =C61+1 -> 45868. | E61: =D61+1 -> 45869. | F61: =E61+1 -> 45870. | G61: =F61+1 -> 45871.
A62: =G61+1 -> 45872. | B62: =A62+1 -> 45873. | C62: =B62+1 -> 45874. | D62: =C62+1 -> 45875. | E62: =D62+1 -> 45876. | F62: =E62+1 -> 45877. | G62: =F62+1 -> 45878.
B64: =B55 -> 2025 | D64: 年 | E64: =E55+1 -> 8 | F64: 月
A65: 星期日 | B65: 星期一 | C65: 星期二 | D65: 星期三 | E65: 星期四 | F65: 星期五 | G65: 星期六
A66: =DATE(B64,E64,2)-WEEKDAY(DATE(B64,E64,1),1) -> 45865. | B66: =A66+1 -> 45866. | C66: =B66+1 -> 45867. | D66: =C66+1 -> 45868. | E66: =D66+1 -> 45869. | F66: =E66+1 -> 45870. | G66: =F66+1 -> 45871.
A67: =G66+1 -> 45872. | B67: =A67+1 -> 45873. | C67: =B67+1 -> 45874. | D67: =C67+1 -> 45875. | E67: =D67+1 -> 45876. | F67: =E67+1 -> 45877. | G67: =F67+1 -> 45878.
A68: =G67+1 -> 45879. | B68: =A68+1 -> 45880. | C68: =B68+1 -> 45881. | D68: =C68+1 -> 45882. | E68: =D68+1 -> 45883. | F68: =E68+1 -> 45884. | G68: =F68+1 -> 45885.
A69: =G68+1 -> 45886. | B69: =A69+1 -> 45887. | C69: =B69+1 -> 45888. | D69: =C69+1 -> 45889. | E69: =D69+1 -> 45890. | F69: =E69+1 -> 45891. | G69: =F69+1 -> 45892.
A70: =G69+1 -> 45893. | B70: =A70+1 -> 45894. | C70: =B70+1 -> 45895. | D70: =C70+1 -> 45896. | E70: =D70+1 -> 45897. | F70: =E70+1 -> 45898. | G70: =F70+1 -> 45899.
A71: =G70+1 -> 45900. | B71: =A71+1 -> 45901. | C71: =B71+1 -> 45902. | D71: =C71+1 -> 45903. | E71: =D71+1 -> 45904. | F71: =E71+1 -> 45905. | G71: =F71+1 -> 45906.
B73: =B64 -> 2025 | D73: 年 | E73: =E64+1 -> 9 | F73: 月
A74: 星期日 | B74: 星期一 | C74: 星期二 | D74: 星期三 | E74: 星期四 | F74: 星期五 | G74: 星期六
A75: =DATE(B73,E73,2)-WEEKDAY(DATE(B73,E73,1),1) -> 45900. | B75: =A75+1 -> 45901. | C75: =B75+1 -> 45902. | D75: =C75+1 -> 45903. | E75: =D75+1 -> 45904. | F75: =E75+1 -> 45905. | G75: =F75+1 -> 45906.
A76: =G75+1 -> 45907. | B76: =A76+1 -> 45908. | C76: =B76+1 -> 45909. | D76: =C76+1 -> 45910. | E76: =D76+1 -> 45911. | F76: =E76+1 -> 45912. | G76: =F76+1 -> 45913.
A77: =G76+1 -> 45914. | B77: =A77+1 -> 45915. | C77: =B77+1 -> 45916. | D77: =C77+1 -> 45917. | E77: =D77+1 -> 45918. | F77: =E77+1 -> 45919. | G77: =F77+1 -> 45920.
A78: =G77+1 -> 45921. | B78: =A78+1 -> 45922. | C78: =B78+1 -> 45923. | D78: =C78+1 -> 45924. | E78: =D78+1 -> 45925. | F78: =E78+1 -> 45926. | G78: =F78+1 -> 45927.
A79: =G78+1 -> 45928. | B79: =A79+1 -> 45929. | C79: =B79+1 -> 45930. | D79: =C79+1 -> 45931. | E79: =D79+1 -> 45932. | F79: =E79+1 -> 45933. | G79: =F79+1 -> 45934.
A80: =G79+1 -> 45935. | B80: =A80+1 -> 45936. | C80: =B80+1 -> 45937. | D80: =C80+1 -> 45938. | E80: =D80+1 -> 45939. | F80: =E80+1 -> 45940. | G80: =F80+1 -> 45941.
B82: =B73 -> 2025 | D82: 年 | E82: =E73+1 -> 10 | F82: 月
A83: 星期日 | B83: 星期一 | C83: 星期二 | D83: 星期三 | E83: 星期四 | F83: 星期五 | G83: 星期六
A84: =DATE(B82,E82,2)-WEEKDAY(DATE(B82,E82,1),1) -> 45928. | B84: =A84+1 -> 45929. | C84: =B84+1 -> 45930. | D84: =C84+1 -> 45931. | E84: =D84+1 -> 45932. | F84: =E84+1 -> 45933. | G84: =F84+1 -> 45934.
A85: =G84+1 -> 45935. | B85: =A85+1 -> 45936. | C85: =B85+1 -> 45937. | D85: =C85+1 -> 45938. | E85: =D85+1 -> 45939. | F85: =E85+1 -> 45940. | G85: =F85+1 -> 45941.
A86: =G85+1 -> 45942. | B86: =A86+1 -> 45943. | C86: =B86+1 -> 45944. | D86: =C86+1 -> 45945. | E86: =D86+1 -> 45946. | F86: =E86+1 -> 45947. | G86: =F86+1 -> 45948.
A87: =G86+1 -> 45949. | B87: =A87+1 -> 45950. | C87: =B87+1 -> 45951. | D87: =C87+1 -> 45952. | E87: =D87+1 -> 45953. | F87: =E87+1 -> 45954. | G87: =F87+1 -> 45955.
A88: =G87+1 -> 45956. | B88: =A88+1 -> 45957. | C88: =B88+1 -> 45958. | D88: =C88+1 -> 45959. | E88: =D88+1 -> 45960. | F88: =E88+1 -> 45961. | G88: =F88+1 -> 45962.
A89: =G88+1 -> 45963. | B89: =A89+1 -> 45964. | C89: =B89+1 -> 45965. | D89: =C89+1 -> 45966. | E89: =D89+1 -> 45967. | F89: =E89+1 -> 45968. | G89: =F89+1 -> 45969.
B91: =B82 -> 2025 | D91: 年 | E91: =E82+1 -> 11 | F91: 月
A92: 星期日 | B92: 星期一 | C92: 星期二 | D92: 星期三 | E92: 星期四 | F92: 星期五 | G92: 星期六
A93: =DATE(B91,E91,2)-WEEKDAY(DATE(B91,E91,1),1) -> 45956. | B93: =A93+1 -> 45957. | C93: =B93+1 -> 45958. | D93: =C93+1 -> 45959. | E93: =D93+1 -> 45960. | F93: =E93+1 -> 45961. | G93: =F93+1 -> 45962.
A94: =G93+1 -> 45963. | B94: =A94+1 -> 45964. | C94: =B94+1 -> 45965. | D94: =C94+1 -> 45966. | E94: =D94+1 -> 45967. | F94: =E94+1 -> 45968. | G94: =F94+1 -> 45969.
A95: =G94+1 -> 45970. | B95: =A95+1 -> 45971. | C95: =B95+1 -> 45972. | D95: =C95+1 -> 45973. | E95: =D95+1 -> 45974. | F95: =E95+1 -> 45975. | G95: =F95+1 -> 45976.
A96: =G95+1 -> 45977. | B96: =A96+1 -> 45978. | C96: =B96+1 -> 45979. | D96: =C96+1 -> 45980. | E96: =D96+1 -> 45981. | F96: =E96+1 -> 45982. | G96: =F96+1 -> 45983.
A97: =G96+1 -> 45984. | B97: =A97+1 -> 45985. | C97: =B97+1 -> 45986. | D97: =C97+1 -> 45987. | E97: =D97+1 -> 45988. | F97: =E97+1 -> 45989. | G97: =F97+1 -> 45990.
A98: =G97+1 -> 45991. | B98: =A98+1 -> 45992. | C98: =B98+1 -> 45993. | D98: =C98+1 -> 45994. | E98: =D98+1 -> 45995. | F98: =E98+1 -> 45996. | G98: =F98+1 -> 45997.
B100: =B91 -> 2025 | D100: 年 | E100: =E91+1 -> 12 | F100: 月
A101: 星期日 | B101: 星期一 | C101: 星期二 | D101: 星期三 | E101: 星期四 | F101: 星期五 | G101: 星期六
A102: =DATE(B100,E100,2)-WEEKDAY(DATE(B100,E100,1),1) -> 45991. | B102: =A102+1 -> 45992. | C102: =B102+1 -> 45993. | D102: =C102+1 -> 45994. | E102: =D102+1 -> 45995. | F102: =E102+1 -> 45996. | G102: =F102+1 -> 45997.
A103: =G102+1 -> 45998. | B103: =A103+1 -> 45999. | C103: =B103+1 -> 46000. | D103: =C103+1 -> 46001. | E103: =D103+1 -> 46002. | F103: =E103+1 -> 46003. | G103: =F103+1 -> 46004.
A104: =G103+1 -> 46005. | B104: =A104+1 -> 46006. | C104: =B104+1 -> 46007. | D104: =C104+1 -> 46008. | E104: =D104+1 -> 46009. | F104: =E104+1 -> 46010. | G104: =F104+1 -> 46011.
A105: =G104+1 -> 46012. | B105: =A105+1 -> 46013. | C105: =B105+1 -> 46014. | D105: =C105+1 -> 46015. | E105: =D105+1 -> 46016. | F105: =E105+1 -> 46017. | G105: =F105+1 -> 46018.
A106: =G105+1 -> 46019. | B106: =A106+1 -> 46020. | C106: =B106+1 -> 46021. | D106: =C106+1 -> 46022. | E106: =D106+1 -> 46023. | F106: =E106+1 -> 46024. | G106: =F106+1 -> 46025.
A107: =G106+1 -> 46026. | B107: =A107+1 -> 46027. | C107: =B107+1 -> 46028. | D107: =C107+1 -> 46029. | E107: =D107+1 -> 46030. | F107: =E107+1 -> 46031. | G107: =F107+1 -> 46032.