A1: 全国各省、自治区、直辖市最低工资标准情况 (截至2024年10月1日)
A2: 单位：元
A3: 地 区 | B3: 月最低工资标准 | F3: 小时最低工资标准
B4: 第一档 | C4: 第二档 | D4: 第三档 | E4: 第四档 | F4: 第一档 | G4: 第二档 | H4: 第三档 | I4: 第四档
A5: 北 京 | B5: 2420 | F5: 26.399999999999999
A6: 小时工资 | B6: =B5/21.75/8 -> 13.908045977011493
A7: 天 津 | B7: 2320 | F7: 24.399999999999999
A8: 小时工资 | B8: =B7/21.75/8 -> 13.333333333333334
A9: 河 北 | B9: 2200 | C9: 2000 | D9: 1800 | F9: 22. | G9: 20. | H9: 18.
A10: 小时工资 | B10: =B9/21.75/8 -> 12.64367816091954 | C10: =C9/21.75/8 -> 11.494252873563218 | D10: =D9/21.75/8 -> 10.344827586206897
A11: 山 西 | B11: 1980 | C11: 1880 | D11: 1780 | F11: 21.300000000000001 | G11: 20.199999999999999 | H11: 19.100000000000001
A12: 小时工资 | B12: =B11/21.75/8 -> 11.379310344827585 | C12: =C11/21.75/8 -> 10.804597701149426 | D12: =D11/21.75/8 -> 10.229885057471265
A13: 内蒙古 | B13: 1980 | C13: 1910 | D13: 1850 | F13: 20.800000000000001 | G13: 20.100000000000001 | H13: 19.5
A14: 小时工资 | B14: =B13/21.75/8 -> 11.379310344827585 | C14: =C13/21.75/8 -> 10.977011494252874 | D14: =D13/21.75/8 -> 10.632183908045977
A15: 辽 宁 | B15: 2100 | C15: 1900 | D15: 1700 | F15: 21. | G15: 19. | H15: 17.
A16: 小时工资 | B16: =B15/21.75/8 -> 12.068965517241379 | C16: =C15/21.75/8 -> 10.919540229885058 | D16: =D15/21.75/8 -> 9.7701149425287355
A17: 吉 林 | B17: 2120 | C17: 1920 | D17: 1780 | F17: 21. | G17: 19.5 | H17: 18.
A18: 小时工资 | B18: =B17/21.75/8 -> 12.183908045977011 | C18: =C17/21.75/8 -> 11.03448275862069 | D18: =D17/21.75/8 -> 10.229885057471265
A19: 黑龙江 | B19: 2080 | C19: 1850 | D19: 1750 | F19: 19. | G19: 17. | H19: 16.5
A20: 小时工资 | B20: =B19/21.75/8 -> 11.954022988505747 | C20: =C19/21.75/8 -> 10.632183908045977 | D20: =D19/21.75/8 -> 10.057471264367816
A21: 上 海 | B21: 2690 | F21: 24.
A22: 小时工资 | B22: =B21/21.75/8 -> 15.459770114942529 | C22: =C21/21.75/8 -> 0 | D22: =D21/21.75/8 -> 0
A23: 江 苏 | B23: 2490 | C23: 2260 | D23: 2010 | F23: 24. | G23: 22. | H23: 20.
A24: 小时工资 | B24: =B23/21.75/8 -> 14.310344827586206 | C24: =C23/21.75/8 -> 12.988505747126437 | D24: =D23/21.75/8 -> 11.551724137931034
A25: 浙 江 | B25: 2490 | C25: 2260 | D25: 2010 | F25: 24. | G25: 22. | H25: 20.
A26: 小时工资 | B26: =B25/21.75/8 -> 14.310344827586206 | C26: =C25/21.75/8 -> 12.988505747126437 | D26: =D25/21.75/8 -> 11.551724137931034
A27: 安 徽 | B27: 2060 | C27: 1930 | D27: 1870 | E27: 1780 | F27: 21. | G27: 20. | H27: 19. | I27: 18.
A28: 小时工资 | B28: =B27/21.75/8 -> 11.839080459770114 | C28: =C27/21.75/8 -> 11.091954022988507 | D28: =D27/21.75/8 -> 10.74712643678161 | E28: =E27/21.75/8 -> 10.229885057471265
A29: 福 建 | B29: 2030 | C29: 1960 | D29: 1810 | E29: 1660 | F29: 21. | G29: 20.5 | H29: 19. | I29: 17.5
A30: 小时工资 | B30: =B29/21.75/8 -> 11.666666666666666 | C30: =C29/21.75/8 -> 11.264367816091953 | D30: =D29/21.75/8 -> 10.402298850574713 | E30: =E29/21.75/8 -> 9.5402298850574709
A31: 江 西 | B31: 2000 | C31: 1870 | D31: 1740 | F31: 20. | G31: 18.699999999999999 | H31: 17.399999999999999
A32: 小时工资 | B32: =B31/21.75/8 -> 11.494252873563218 | C32: =C31/21.75/8 -> 10.74712643678161 | D32: =D31/21.75/8 -> 10.
A33: 山 东 | B33: 2200 | C33: 2010 | D33: 1820 | F33: 22. | G33: 20. | H33: 18.
A34: 小时工资 | B34: =B33/21.75/8 -> 12.64367816091954 | C34: =C33/21.75/8 -> 11.551724137931034 | D34: =D33/21.75/8 -> 10.459770114942529
A35: 河 南 | B35: 2100 | C35: 2000 | D35: 1800 | F35: 20.600000000000001 | G35: 19.600000000000001 | H35: 17.600000000000001
A36: 小时工资 | B36: =B35/21.75/8 -> 12.068965517241379 | C36: =C35/21.75/8 -> 11.494252873563218 | D36: =D35/21.75/8 -> 10.344827586206897
A37: 湖 北 | B37: 2210 | C37: 1950 | D37: 1800 | F37: 22. | G37: 19.5 | H37: 18.
A38: 小时工资 | B38: =B37/21.75/8 -> 12.701149425287356 | C38: =C37/21.75/8 -> 11.206896551724139 | D38: =D37/21.75/8 -> 10.344827586206897
A39: 湖 南 | B39: 2100 | C39: 1900 | D39: 1700 | F39: 21. | G39: 19. | H39: 17.
A40: 小时工资 | B40: =B39/21.75/8 -> 12.068965517241379 | C40: =C39/21.75/8 -> 10.919540229885058 | D40: =D39/21.75/8 -> 9.7701149425287355
A41: 广 东 | B41: 2300 | C41: 1900 | D41: 1720 | E41: 1620 | F41: 22.199999999999999 | G41: 18.100000000000001 | H41: 17. | I41: 16.100000000000001
A42: 小时工资 | B42: =B41/21.75/8 -> 13.218390804597702 | C42: =C41/21.75/8 -> 10.919540229885058 | D42: =D41/21.75/8 -> 9.8850574712643677 | E42: =E41/21.75/8 -> 9.3103448275862064
A43: 其中：深圳 | B43: 2360 | F43: 22.199999999999999
A44: 小时工资 | B44: =B43/21.75/8 -> 13.563218390804598
A45: 广 西 | B45: 1990 | C45: 1840 | D45: 1690 | F45: 20.100000000000001 | G45: 18.600000000000001 | H45: 17.
A46: 小时工资 | B46: =B45/21.75/8 -> 11.436781609195402 | C46: =C45/21.75/8 -> 10.574712643678161 | D46: =D45/21.75/8 -> 9.7126436781609193 | E46: =E45/21.75/8 -> 0
A47: 海 南 | B47: 2010 | C47: 1850 | F47: 17.899999999999999 | G47: 16.300000000000001
A48: 小时工资 | B48: =B47/21.75/8 -> 11.551724137931034 | C48: =C47/21.75/8 -> 10.632183908045977 | D48: =D47/21.75/8 -> 0 | E48: =E47/21.75/8 -> 0
A49: 重 庆 | B49: 2100 | C49: 2000 | F49: 21. | G49: 20.
A50: 小时工资 | B50: =B49/21.75/8 -> 12.068965517241379 | C50: =C49/21.75/8 -> 11.494252873563218 | D50: =D49/21.75/8 -> 0 | E50: =E49/21.75/8 -> 0
A51: 四 川 | B51: 2100 | C51: 1970 | D51: 1870 | F51: 22. | G51: 21. | H51: 20.
A52: 小时工资 | B52: =B51/21.75/8 -> 12.068965517241379 | C52: =C51/21.75/8 -> 11.321839080459769 | D52: =D51/21.75/8 -> 10.74712643678161 | E52: =E51/21.75/8 -> 0
A53: 贵 州 | B53: 1890 | C53: 1760 | D53: 1660 | F53: 19.600000000000001 | G53: 18.300000000000001 | H53: 17.199999999999999
A54: 小时工资 | B54: =B53/21.75/8 -> 10.862068965517242 | C54: =C53/21.75/8 -> 10.114942528735632 | D54: =D53/21.75/8 -> 9.5402298850574709 | E54: =E53/21.75/8 -> 0
A55: 云 南 | B55: 2070 | C55: 1920 | D55: 1770 | F55: 20. | G55: 19. | H55: 18.
A56: 小时工资 | B56: =B55/21.75/8 -> 11.896551724137931 | C56: =C55/21.75/8 -> 11.03448275862069 | D56: =D55/21.75/8 -> 10.172413793103448 | E56: =E55/21.75/8 -> 0
A57: 西 藏 | B57: 2100 | F57: 20.
A58: 小时工资 | B58: =B57/21.75/8 -> 12.068965517241379 | C58: =C57/21.75/8 -> 0 | D58: =D57/21.75/8 -> 0 | E58: =E57/21.75/8 -> 0
A59: 陕 西 | B59: 2160 | C59: 2050 | D59: 1950 | F59: 21. | G59: 20. | H59: 19.
A60: 小时工资 | B60: =B59/21.75/8 -> 12.413793103448276 | C60: =C59/21.75/8 -> 11.781609195402298 | D60: =D59/21.75/8 -> 11.206896551724139 | E60: =E59/21.75/8 -> 0
A61: 甘 肃 | B61: 2020 | C61: 1960 | D61: 1910 | E61: 1850 | F61: 21. | G61: 20.5 | H61: 20. | I61: 19.5
A62: 小时工资 | B62: =B61/21.75/8 -> 11.60919540229885 | C62: =C61/21.75/8 -> 11.264367816091953 | D62: =D61/21.75/8 -> 10.977011494252874 | E62: =E61/21.75/8 -> 10.632183908045977
A63: 青 海 | B63: 1880 | F63: 18.
A64: 小时工资 | B64: =B63/21.75/8 -> 10.804597701149426 | C64: =C63/21.75/8 -> 0 | D64: =D63/21.75/8 -> 0 | E64: =E63/21.75/8 -> 0
A65: 宁 夏 | B65: 2050 | C65: 1900 | F65: 20. | G65: 18.
A66: 小时工资 | B66: =B65/21.75/8 -> 11.781609195402298 | C66: =C65/21.75/8 -> 10.919540229885058 | D66: =D65/21.75/8 -> 0. | E66: =E65/21.75/8 -> 0.
A67: 新 疆 | B67: 1900 | C67: 1700 | D67: 1620 | E67: 1540 | F67: 19. | G67: 17. | H67: 16.199999999999999 | I67: 15.4
A68: 小时工资 | B68: =B67/21.75/8 -> 10.919540229885058 | C68: =C67/21.75/8 -> 9.7701149425287355 | D68: =D67/21.75/8 -> 9.3103448275862064 | E68: =E67/21.75/8 -> 8.8505747126436773