A1: 网上用户,上网用户一 | D1: 2025 | E1: 年岁数属相生肖对照表一网上用户,上网用户
A2: 生肖 | B2: =MID("鼠牛虎兔龙蛇马羊猴鸡狗猪",MOD(MID(B3,1,4)-4,12)+1,1) -> 蛇 | C2: =MID("鼠牛虎兔龙蛇马羊猴鸡狗猪",MOD(MID(C3,1,4)-4,12)+1,1) -> 龙 | D2: =MID("鼠牛虎兔龙蛇马羊猴鸡狗猪",MOD(MID(D3,1,4)-4,12)+1,1) -> 兔 | E2: =MID("鼠牛虎兔龙蛇马羊猴鸡狗猪",MOD(MID(E3,1,4)-4,12)+1,1) -> 虎 | F2: =MID("鼠牛虎兔龙蛇马羊猴鸡狗猪",MOD(MID(F3,1,4)-4,12)+1,1) -> 牛 | G2: =MID("鼠牛虎兔龙蛇马羊猴鸡狗猪",MOD(MID(G3,1,4)-4,12)+1,1) -> 鼠 | H2: =MID("鼠牛虎兔龙蛇马羊猴鸡狗猪",MOD(MID(H3,1,4)-4,12)+1,1) -> 猪 | I2: =MID("鼠牛虎兔龙蛇马羊猴鸡狗猪",MOD(MID(I3,1,4)-4,12)+1,1) -> 狗 | J2: =MID("鼠牛虎兔龙蛇马羊猴鸡狗猪",MOD(MID(J3,1,4)-4,12)+1,1) -> 鸡 | K2: =MID("鼠牛虎兔龙蛇马羊猴鸡狗猪",MOD(MID(K3,1,4)-4,12)+1,1) -> 猴 | L2: =MID("鼠牛虎兔龙蛇马羊猴鸡狗猪",MOD(MID(L3,1,4)-4,12)+1,1) -> 羊 | M2: =MID("鼠牛虎兔龙蛇马羊猴鸡狗猪",MOD(MID(M3,1,4)-4,12)+1,1) -> 马
A3: 出生年份 | B3: =D1 -> 2025 | C3: =B3-1 -> 2024 | D3: =C3-1 -> 2023 | E3: =D3-1 -> 2022 | F3: =E3-1 -> 2021 | G3: =F3-1 -> 2020 | H3: =G3-1 -> 2019 | I3: =H3-1 -> 2018 | J3: =I3-1 -> 2017 | K3: =J3-1 -> 2016 | L3: =K3-1 -> 2015 | M3: =L3-1 -> 2014
A5: 虚岁 | B5: 1 | C5: 2 | D5: 3 | E5: 4 | F5: 5 | G5: 6 | H5: 7 | I5: 8 | J5: 9 | K5: 10 | L5: 11 | M5: 12
A6: 出生年份 | B6: =M3-1 -> 2013 | C6: =B6-1 -> 2012 | D6: =C6-1 -> 2011 | E6: =D6-1 -> 2010 | F6: =E6-1 -> 2009 | G6: =F6-1 -> 2008 | H6: =G6-1 -> 2007 | I6: =H6-1 -> 2006 | J6: =I6-1 -> 2005 | K6: =J6-1 -> 2004 | L6: =K6-1 -> 2003 | M6: =L6-1 -> 2002
A7: 虚岁 | B7: =M5+1 -> 13 | C7: =B7+1 -> 14 | D7: =C7+1 -> 15 | E7: =D7+1 -> 16 | F7: =E7+1 -> 17 | G7: =F7+1 -> 18 | H7: =G7+1 -> 19 | I7: =H7+1 -> 20 | J7: =I7+1 -> 21 | K7: =J7+1 -> 22 | L7: =K7+1 -> 23 | M7: =L7+1 -> 24
A8: 出生年份 | B8: =M6-1 -> 2001 | C8: =B8-1 -> 2000 | D8: =C8-1 -> 1999 | E8: =D8-1 -> 1998 | F8: =E8-1 -> 1997 | G8: =F8-1 -> 1996 | H8: =G8-1 -> 1995 | I8: =H8-1 -> 1994 | J8: =I8-1 -> 1993 | K8: =J8-1 -> 1992 | L8: =K8-1 -> 1991 | M8: =L8-1 -> 1990
A9: 虚岁 | B9: =M7+1 -> 25 | C9: =B9+1 -> 26 | D9: =C9+1 -> 27 | E9: =D9+1 -> 28 | F9: =E9+1 -> 29 | G9: =F9+1 -> 30 | H9: =G9+1 -> 31 | I9: =H9+1 -> 32 | J9: =I9+1 -> 33 | K9: =J9+1 -> 34 | L9: =K9+1 -> 35 | M9: =L9+1 -> 36
A10: 出生年份 | B10: =M8-1 -> 1989 | C10: =B10-1 -> 1988 | D10: =C10-1 -> 1987 | E10: =D10-1 -> 1986 | F10: =E10-1 -> 1985 | G10: =F10-1 -> 1984 | H10: =G10-1 -> 1983 | I10: =H10-1 -> 1982 | J10: =I10-1 -> 1981 | K10: =J10-1 -> 1980 | L10: =K10-1 -> 1979 | M10: =L10-1 -> 1978
A11: 虚岁 | B11: =M9+1 -> 37 | C11: =B11+1 -> 38 | D11: =C11+1 -> 39 | E11: =D11+1 -> 40 | F11: =E11+1 -> 41 | G11: =F11+1 -> 42 | H11: =G11+1 -> 43 | I11: =H11+1 -> 44 | J11: =I11+1 -> 45 | K11: =J11+1 -> 46 | L11: =K11+1 -> 47 | M11: =L11+1 -> 48
A12: 出生年份 | B12: =M10-1 -> 1977 | C12: =B12-1 -> 1976 | D12: =C12-1 -> 1975 | E12: =D12-1 -> 1974 | F12: =E12-1 -> 1973 | G12: =F12-1 -> 1972 | H12: =G12-1 -> 1971 | I12: =H12-1 -> 1970 | J12: =I12-1 -> 1969 | K12: =J12-1 -> 1968 | L12: =K12-1 -> 1967 | M12: =L12-1 -> 1966
A13: 虚岁 | B13: =M11+1 -> 49 | C13: =B13+1 -> 50 | D13: =C13+1 -> 51 | E13: =D13+1 -> 52 | F13: =E13+1 -> 53 | G13: =F13+1 -> 54 | H13: =G13+1 -> 55 | I13: =H13+1 -> 56 | J13: =I13+1 -> 57 | K13: =J13+1 -> 58 | L13: =K13+1 -> 59 | M13: =L13+1 -> 60
A14: 出生年份 | B14: =M12-1 -> 1965 | C14: =B14-1 -> 1964 | D14: =C14-1 -> 1963 | E14: =D14-1 -> 1962 | F14: =E14-1 -> 1961 | G14: =F14-1 -> 1960 | H14: =G14-1 -> 1959 | I14: =H14-1 -> 1958 | J14: =I14-1 -> 1957 | K14: =J14-1 -> 1956 | L14: =K14-1 -> 1955 | M14: =L14-1 -> 1954
A15: 虚岁 | B15: =M13+1 -> 61 | C15: =B15+1 -> 62 | D15: =C15+1 -> 63 | E15: =D15+1 -> 64 | F15: =E15+1 -> 65 | G15: =F15+1 -> 66 | H15: =G15+1 -> 67 | I15: =H15+1 -> 68 | J15: =I15+1 -> 69 | K15: =J15+1 -> 70 | L15: =K15+1 -> 71 | M15: =L15+1 -> 72
A16: 出生年份 | B16: =M14-1 -> 1953 | C16: =B16-1 -> 1952 | D16: =C16-1 -> 1951 | E16: =D16-1 -> 1950 | F16: =E16-1 -> 1949 | G16: =F16-1 -> 1948 | H16: =G16-1 -> 1947 | I16: =H16-1 -> 1946 | J16: =I16-1 -> 1945 | K16: =J16-1 -> 1944 | L16: =K16-1 -> 1943 | M16: =L16-1 -> 1942
A17: 虚岁 | B17: =M15+1 -> 73 | C17: =B17+1 -> 74 | D17: =C17+1 -> 75 | E17: =D17+1 -> 76 | F17: =E17+1 -> 77 | G17: =F17+1 -> 78 | H17: =G17+1 -> 79 | I17: =H17+1 -> 80 | J17: =I17+1 -> 81 | K17: =J17+1 -> 82 | L17: =K17+1 -> 83 | M17: =L17+1 -> 84
A18: 出生年份 | B18: =M16-1 -> 1941 | C18: =B18-1 -> 1940 | D18: =C18-1 -> 1939 | E18: =D18-1 -> 1938 | F18: =E18-1 -> 1937 | G18: =F18-1 -> 1936 | H18: =G18-1 -> 1935 | I18: =H18-1 -> 1934 | J18: =I18-1 -> 1933 | K18: =J18-1 -> 1932 | L18: =K18-1 -> 1931 | M18: =L18-1 -> 1930
A19: 虚岁 | B19: =M17+1 -> 85 | C19: =B19+1 -> 86 | D19: =C19+1 -> 87 | E19: =D19+1 -> 88 | F19: =E19+1 -> 89 | G19: =F19+1 -> 90 | H19: =G19+1 -> 91 | I19: =H19+1 -> 92 | J19: =I19+1 -> 93 | K19: =J19+1 -> 94 | L19: =K19+1 -> 95 | M19: =L19+1 -> 96
A20: 出生年份 | B20: =M18-1 -> 1929 | C20: =B20-1 -> 1928 | D20: =C20-1 -> 1927 | E20: =D20-1 -> 1926 | F20: =E20-1 -> 1925 | G20: =F20-1 -> 1924 | H20: =G20-1 -> 1923 | I20: =H20-1 -> 1922 | J20: =I20-1 -> 1921 | K20: =J20-1 -> 1920 | L20: =K20-1 -> 1919 | M20: =L20-1 -> 1918
A21: 虚岁 | B21: =M19+1 -> 97 | C21: =B21+1 -> 98 | D21: =C21+1 -> 99 | E21: =D21+1 -> 100 | F21: =E21+1 -> 101 | G21: =F21+1 -> 102 | H21: =G21+1 -> 103 | I21: =H21+1 -> 104 | J21: =I21+1 -> 105 | K21: =J21+1 -> 106 | L21: =K21+1 -> 107 | M21: =L21+1 -> 108
A22: 出生年份 | B22: =M20-1 -> 1917 | C22: =B22-1 -> 1916 | D22: =C22-1 -> 1915 | E22: =D22-1 -> 1914 | F22: =E22-1 -> 1913 | G22: =F22-1 -> 1912 | H22: =G22-1 -> 1911 | I22: =H22-1 -> 1910 | J22: =I22-1 -> 1909 | K22: =J22-1 -> 1908 | L22: =K22-1 -> 1907 | M22: =L22-1 -> 1906
A23: 虚岁 | B23: =M21+1 -> 109 | C23: =B23+1 -> 110 | D23: =C23+1 -> 111 | E23: =D23+1 -> 112 | F23: =E23+1 -> 113 | G23: =F23+1 -> 114 | H23: =G23+1 -> 115 | I23: =H23+1 -> 116 | J23: =I23+1 -> 117 | K23: =J23+1 -> 118 | L23: =K23+1 -> 119 | M23: =L23+1 -> 120
A24: 网上用户,上网用户一 | D24: =D1 -> 2025 | E24: 年岁数属相生肖对照表一网上用户,上网用户