A1: 1 | B1: ÷ | C1: 1 | D1: = | E1: =A1/C1 -> 1
A2: 2 | B2: ÷ | C2: =C1 -> 1 | D2: = | E2: =A2/C2 -> 2 | G2: 4 | H2: ÷ | I2: 2 | J2: = | K2: =G2/I2 -> 2
A3: 3 | B3: ÷ | C3: =C2 -> 1 | D3: = | E3: =A3/C3 -> 3 | G3: 6 | H3: ÷ | I3: =I2 -> 2 | J3: = | K3: =G3/I3 -> 3 | M3: 9 | N3: ÷ | O3: 3 | P3: = | Q3: =M3/O3 -> 3
A4: 4 | B4: ÷ | C4: =C3 -> 1 | D4: = | E4: =A4/C4 -> 4 | G4: 8 | H4: ÷ | I4: =I3 -> 2 | J4: = | K4: =G4/I4 -> 4 | M4: 12 | N4: ÷ | O4: =O3 -> 3 | P4: = | Q4: =M4/O4 -> 4 | S4: 16 | T4: ÷ | U4: 4 | V4: = | W4: =S4/U4 -> 4
A5: 5 | B5: ÷ | C5: =C4 -> 1 | D5: = | E5: =A5/C5 -> 5 | G5: 10 | H5: ÷ | I5: =I4 -> 2 | J5: = | K5: =G5/I5 -> 5 | M5: 15 | N5: ÷ | O5: =O4 -> 3 | P5: = | Q5: =M5/O5 -> 5 | S5: 20 | T5: ÷ | U5: =U4 -> 4 | V5: = | W5: =S5/U5 -> 5 | Y5: 25 | Z5: ÷ | AA5: 5 | AB5: = | AC5: =Y5/AA5 -> 5
A6: 6 | B6: ÷ | C6: =C5 -> 1 | D6: = | E6: =A6/C6 -> 6 | G6: 12 | H6: ÷ | I6: =I5 -> 2 | J6: = | K6: =G6/I6 -> 6 | M6: 18 | N6: ÷ | O6: =O5 -> 3 | P6: = | Q6: =M6/O6 -> 6 | S6: 24 | T6: ÷ | U6: =U5 -> 4 | V6: = | W6: =S6/U6 -> 6 | Y6: 30 | Z6: ÷ | AA6: =AA5 -> 5 | AB6: = | AC6: =Y6/AA6 -> 6 | AE6: 36 | AF6: ÷ | AG6: 6 | AH6: = | AI6: =AE6/AG6 -> 6
A7: 7 | B7: ÷ | C7: =C6 -> 1 | D7: = | E7: =A7/C7 -> 7 | G7: 14 | H7: ÷ | I7: =I6 -> 2 | J7: = | K7: =G7/I7 -> 7 | M7: 21 | N7: ÷ | O7: =O6 -> 3 | P7: = | Q7: =M7/O7 -> 7 | S7: 28 | T7: ÷ | U7: =U6 -> 4 | V7: = | W7: =S7/U7 -> 7 | Y7: 35 | Z7: ÷ | AA7: =AA6 -> 5 | AB7: = | AC7: =Y7/AA7 -> 7 | AE7: 42 | AF7: ÷ | AG7: =AG6 -> 6 | AH7: = | AI7: =AE7/AG7 -> 7 | AK7: 49 | AL7: ÷ | AM7: 7 | AN7: = | AO7: =AK7/AM7 -> 7
A8: 8 | B8: ÷ | C8: =C7 -> 1 | D8: = | E8: =A8/C8 -> 8 | G8: 16 | H8: ÷ | I8: =I7 -> 2 | J8: = | K8: =G8/I8 -> 8 | M8: 24 | N8: ÷ | O8: =O7 -> 3 | P8: = | Q8: =M8/O8 -> 8 | S8: 32 | T8: ÷ | U8: =U7 -> 4 | V8: = | W8: =S8/U8 -> 8 | Y8: 40 | Z8: ÷ | AA8: =AA7 -> 5 | AB8: = | AC8: =Y8/AA8 -> 8 | AE8: 48 | AF8: ÷ | AG8: =AG7 -> 6 | AH8: = | AI8: =AE8/AG8 -> 8 | AK8: 56 | AL8: ÷ | AM8: =AM7 -> 7 | AN8: = | AO8: =AK8/AM8 -> 8 | AQ8: 64 | AR8: ÷ | AS8: 8 | AT8: = | AU8: =AQ8/AS8 -> 8
A9: 9 | B9: ÷ | C9: =C8 -> 1 | D9: = | E9: =A9/C9 -> 9 | G9: 18 | H9: ÷ | I9: =I8 -> 2 | J9: = | K9: =G9/I9 -> 9 | M9: 27 | N9: ÷ | O9: =O8 -> 3 | P9: = | Q9: =M9/O9 -> 9 | S9: 36 | T9: ÷ | U9: =U8 -> 4 | V9: = | W9: =S9/U9 -> 9 | Y9: 45 | Z9: ÷ | AA9: =AA8 -> 5 | AB9: = | AC9: =Y9/AA9 -> 9 | AE9: 54 | AF9: ÷ | AG9: =AG8 -> 6 | AH9: = | AI9: =AE9/AG9 -> 9 | AK9: 63 | AL9: ÷ | AM9: =AM8 -> 7 | AN9: = | AO9: =AK9/AM9 -> 9 | AQ9: 72 | AR9: ÷ | AS9: =AS8 -> 8 | AT9: = | AU9: =AQ9/AS9 -> 9 | AW9: 81 | AX9: ÷ | AY9: 9 | AZ9: = | BA9: =AW9/AY9 -> 9