B2: 1 | C2: + | D2: 1 | E2: = | F2: =B2+D2 -> 2
B3: 1 | C3: + | D3: 2 | E3: = | F3: =B3+D3 -> 3 | H3: 2 | I3: + | J3: 2 | K3: = | L3: =H3+J3 -> 4
B4: 1 | C4: + | D4: 3 | E4: = | F4: =B4+D4 -> 4 | H4: 2 | I4: + | J4: 3 | K4: = | L4: =H4+J4 -> 5 | N4: 3 | O4: + | P4: 3 | Q4: = | R4: =N4+P4 -> 6
B5: 1 | C5: + | D5: 4 | E5: = | F5: =B5+D5 -> 5 | H5: 2 | I5: + | J5: 4 | K5: = | L5: =H5+J5 -> 6 | N5: 3 | O5: + | P5: 4 | Q5: = | R5: =N5+P5 -> 7 | T5: 4 | U5: + | V5: 4 | W5: = | X5: =T5+V5 -> 8
B6: 1 | C6: + | D6: 5 | E6: = | F6: =B6+D6 -> 6 | H6: 2 | I6: + | J6: 5 | K6: = | L6: =H6+J6 -> 7 | N6: 3 | O6: + | P6: 5 | Q6: = | R6: =N6+P6 -> 8 | T6: 4 | U6: + | V6: 5 | W6: = | X6: =T6+V6 -> 9 | Z6: 5 | AA6: + | AB6: 5 | AC6: = | AD6: =Z6+AB6 -> 10
B7: 1 | C7: + | D7: 6 | E7: = | F7: =B7+D7 -> 7 | H7: 2 | I7: + | J7: 6 | K7: = | L7: =H7+J7 -> 8 | N7: 3 | O7: + | P7: 6 | Q7: = | R7: =N7+P7 -> 9 | T7: 4 | U7: + | V7: 6 | W7: = | X7: =T7+V7 -> 10 | Z7: 5 | AA7: + | AB7: 6 | AC7: = | AD7: =Z7+AB7 -> 11 | AF7: 6 | AG7: + | AH7: 6 | AI7: = | AJ7: =AF7+AH7 -> 12
B8: 1 | C8: + | D8: 7 | E8: = | F8: =B8+D8 -> 8 | H8: 2 | I8: + | J8: 7 | K8: = | L8: =H8+J8 -> 9 | N8: 3 | O8: + | P8: 7 | Q8: = | R8: =N8+P8 -> 10 | T8: 4 | U8: + | V8: 7 | W8: = | X8: =T8+V8 -> 11 | Z8: 5 | AA8: + | AB8: 7 | AC8: = | AD8: =Z8+AB8 -> 12 | AF8: 6 | AG8: + | AH8: 7 | AI8: = | AJ8: =AF8+AH8 -> 13 | AL8: 7 | AM8: + | AN8: 7 | AO8: = | AP8: =AL8+AN8 -> 14
B9: 1 | C9: + | D9: 8 | E9: = | F9: =B9+D9 -> 9 | H9: 2 | I9: + | J9: 8 | K9: = | L9: =H9+J9 -> 10 | N9: 3 | O9: + | P9: 8 | Q9: = | R9: =N9+P9 -> 11 | T9: 4 | U9: + | V9: 8 | W9: = | X9: =T9+V9 -> 12 | Z9: 5 | AA9: + | AB9: 8 | AC9: = | AD9: =Z9+AB9 -> 13 | AF9: 6 | AG9: + | AH9: 8 | AI9: = | AJ9: =AF9+AH9 -> 14 | AL9: 7 | AM9: + | AN9: 8 | AO9: = | AP9: =AL9+AN9 -> 15 | AR9: 8 | AS9: + | AT9: 8 | AU9: = | AV9: =AR9+AT9 -> 16
B10: 1 | C10: + | D10: 9 | E10: = | F10: =B10+D10 -> 10 | H10: 2 | I10: + | J10: 9 | K10: = | L10: =H10+J10 -> 11 | N10: 3 | O10: + | P10: 9 | Q10: = | R10: =N10+P10 -> 12 | T10: 4 | U10: + | V10: 9 | W10: = | X10: =T10+V10 -> 13 | Z10: 5 | AA10: + | AB10: 9 | AC10: = | AD10: =Z10+AB10 -> 14 | AF10: 6 | AG10: + | AH10: 9 | AI10: = | AJ10: =AF10+AH10 -> 15 | AL10: 7 | AM10: + | AN10: 9 | AO10: = | AP10: =AL10+AN10 -> 16 | AR10: 8 | AS10: + | AT10: 9 | AU10: = | AV10: =AR10+AT10 -> 17 | AX10: 9 | AY10: + | AZ10: 9 | BA10: = | BB10: =AX10+AZ10 -> 18
B13: 1 | C13: x | D13: 1 | E13: = | F13: =B13*D13 -> 1 | AQ13: 网名张先生
B14: 1 | C14: x | D14: 2 | E14: = | F14: =B14*D14 -> 2 | H14: 2 | I14: x | J14: 2 | K14: = | L14: =H14*J14 -> 4
B15: 1 | C15: x | D15: 3 | E15: = | F15: =B15*D15 -> 3 | H15: 2 | I15: x | J15: 3 | K15: = | L15: =H15*J15 -> 6 | N15: 3 | O15: x | P15: 3 | Q15: = | R15: =N15*P15 -> 9
B16: 1 | C16: x | D16: 4 | E16: = | F16: =B16*D16 -> 4 | H16: 2 | I16: x | J16: 4 | K16: = | L16: =H16*J16 -> 8 | N16: 3 | O16: x | P16: 4 | Q16: = | R16: =N16*P16 -> 12 | T16: 4 | U16: x | V16: 4 | W16: = | X16: =T16*V16 -> 16
B17: 1 | C17: x | D17: 5 | E17: = | F17: =B17*D17 -> 5 | H17: 2 | I17: x | J17: 5 | K17: = | L17: =H17*J17 -> 10 | N17: 3 | O17: x | P17: 5 | Q17: = | R17: =N17*P17 -> 15 | T17: 4 | U17: x | V17: 5 | W17: = | X17: =T17*V17 -> 20 | Z17: 5 | AA17: x | AB17: 5 | AC17: = | AD17: =Z17*AB17 -> 25
B18: 1 | C18: x | D18: 6 | E18: = | F18: =B18*D18 -> 6 | H18: 2 | I18: x | J18: 6 | K18: = | L18: =H18*J18 -> 12 | N18: 3 | O18: x | P18: 6 | Q18: = | R18: =N18*P18 -> 18 | T18: 4 | U18: x | V18: 6 | W18: = | X18: =T18*V18 -> 24 | Z18: 5 | AA18: x | AB18: 6 | AC18: = | AD18: =Z18*AB18 -> 30 | AF18: 6 | AG18: x | AH18: 6 | AI18: = | AJ18: =AF18*AH18 -> 36
B19: 1 | C19: x | D19: 7 | E19: = | F19: =B19*D19 -> 7 | H19: 2 | I19: x | J19: 7 | K19: = | L19: =H19*J19 -> 14 | N19: 3 | O19: x | P19: 7 | Q19: = | R19: =N19*P19 -> 21 | T19: 4 | U19: x | V19: 7 | W19: = | X19: =T19*V19 -> 28 | Z19: 5 | AA19: x | AB19: 7 | AC19: = | AD19: =Z19*AB19 -> 35 | AF19: 6 | AG19: x | AH19: 7 | AI19: = | AJ19: =AF19*AH19 -> 42 | AL19: 7 | AM19: x | AN19: 7 | AO19: = | AP19: =AL19*AN19 -> 49
B20: 1 | C20: x | D20: 8 | E20: = | F20: =B20*D20 -> 8 | H20: 2 | I20: x | J20: 8 | K20: = | L20: =H20*J20 -> 16 | N20: 3 | O20: x | P20: 8 | Q20: = | R20: =N20*P20 -> 24 | T20: 4 | U20: x | V20: 8 | W20: = | X20: =T20*V20 -> 32 | Z20: 5 | AA20: x | AB20: 8 | AC20: = | AD20: =Z20*AB20 -> 40 | AF20: 6 | AG20: x | AH20: 8 | AI20: = | AJ20: =AF20*AH20 -> 48 | AL20: 7 | AM20: x | AN20: 8 | AO20: = | AP20: =AL20*AN20 -> 56 | AR20: 8 | AS20: x | AT20: 8 | AU20: = | AV20: =AR20*AT20 -> 64
B21: 1 | C21: x | D21: 9 | E21: = | F21: =B21*D21 -> 9 | H21: 2 | I21: x | J21: 9 | K21: = | L21: =H21*J21 -> 18 | N21: 3 | O21: x | P21: 9 | Q21: = | R21: =N21*P21 -> 27 | T21: 4 | U21: x | V21: 9 | W21: = | X21: =T21*V21 -> 36 | Z21: 5 | AA21: x | AB21: 9 | AC21: = | AD21: =Z21*AB21 -> 45 | AF21: 6 | AG21: x | AH21: 9 | AI21: = | AJ21: =AF21*AH21 -> 54 | AL21: 7 | AM21: x | AN21: 9 | AO21: = | AP21: =AL21*AN21 -> 63 | AR21: 8 | AS21: x | AT21: 9 | AU21: = | AV21: =AR21*AT21 -> 72 | AX21: 9 | AY21: x | AZ21: 9 | BA21: = | BB21: =AX21*AZ21 -> 81
B24: 9 | C24: - | D24: 9 | E24: = | F24: =B24-D24 -> 0
B25: 9 | C25: - | D25: 8 | E25: = | F25: =B25-D25 -> 1 | H25: 8 | I25: - | J25: 8 | K25: = | L25: =H25-J25 -> 0
B26: 9 | C26: - | D26: 7 | E26: = | F26: =B26-D26 -> 2 | H26: 8 | I26: - | J26: 7 | K26: = | L26: =H26-J26 -> 1 | N26: 7 | O26: - | P26: 7 | Q26: = | R26: =N26-P26 -> 0
B27: 9 | C27: - | D27: 6 | E27: = | F27: =B27-D27 -> 3 | H27: 8 | I27: - | J27: 6 | K27: = | L27: =H27-J27 -> 2 | N27: 7 | O27: - | P27: 6 | Q27: = | R27: =N27-P27 -> 1 | T27: 6 | U27: - | V27: 6 | W27: = | X27: =T27-V27 -> 0
B28: 9 | C28: - | D28: 5 | E28: = | F28: =B28-D28 -> 4 | H28: 8 | I28: - | J28: 5 | K28: = | L28: =H28-J28 -> 3 | N28: 7 | O28: - | P28: 5 | Q28: = | R28: =N28-P28 -> 2 | T28: 6 | U28: - | V28: 5 | W28: = | X28: =T28-V28 -> 1 | Z28: 5 | AA28: - | AB28: 5 | AC28: = | AD28: =Z28-AB28 -> 0
B29: 9 | C29: - | D29: 4 | E29: = | F29: =B29-D29 -> 5 | H29: 8 | I29: - | J29: 4 | K29: = | L29: =H29-J29 -> 4 | N29: 7 | O29: - | P29: 4 | Q29: = | R29: =N29-P29 -> 3 | T29: 6 | U29: - | V29: 4 | W29: = | X29: =T29-V29 -> 2 | Z29: 5 | AA29: - | AB29: 4 | AC29: = | AD29: =Z29-AB29 -> 1 | AF29: 4 | AG29: - | AH29: 4 | AI29: = | AJ29: =AF29-AH29 -> 0
B30: 9 | C30: - | D30: 3 | E30: = | F30: =B30-D30 -> 6 | H30: 8 | I30: - | J30: 3 | K30: = | L30: =H30-J30 -> 5 | N30: 7 | O30: - | P30: 3 | Q30: = | R30: =N30-P30 -> 4 | T30: 6 | U30: - | V30: 3 | W30: = | X30: =T30-V30 -> 3 | Z30: 5 | AA30: - | AB30: 3 | AC30: = | AD30: =Z30-AB30 -> 2 | AF30: 4 | AG30: - | AH30: 3 | AI30: = | AJ30: =AF30-AH30 -> 1 | AL30: 3 | AM30: - | AN30: 3 | AO30: = | AP30: =AL30-AN30 -> 0
B31: 9 | C31: - | D31: 2 | E31: = | F31: =B31-D31 -> 7 | H31: 8 | I31: - | J31: 2 | K31: = | L31: =H31-J31 -> 6 | N31: 7 | O31: - | P31: 2 | Q31: = | R31: =N31-P31 -> 5 | T31: 6 | U31: - | V31: 2 | W31: = | X31: =T31-V31 -> 4 | Z31: 5 | AA31: - | AB31: 2 | AC31: = | AD31: =Z31-AB31 -> 3 | AF31: 4 | AG31: - | AH31: 2 | AI31: = | AJ31: =AF31-AH31 -> 2 | AL31: 3 | AM31: - | AN31: 2 | AO31: = | AP31: =AL31-AN31 -> 1 | AR31: 2 | AS31: - | AT31: 2 | AU31: = | AV31: =AR31-AT31 -> 0
B32: 9 | C32: - | D32: 1 | E32: = | F32: =B32-D32 -> 8 | H32: 8 | I32: - | J32: 1 | K32: = | L32: =H32-J32 -> 7 | N32: 7 | O32: - | P32: 1 | Q32: = | R32: =N32-P32 -> 6 | T32: 6 | U32: - | V32: 1 | W32: = | X32: =T32-V32 -> 5 | Z32: 5 | AA32: - | AB32: 1 | AC32: = | AD32: =Z32-AB32 -> 4 | AF32: 4 | AG32: - | AH32: 1 | AI32: = | AJ32: =AF32-AH32 -> 3 | AL32: 3 | AM32: - | AN32: 1 | AO32: = | AP32: =AL32-AN32 -> 2 | AR32: 2 | AS32: - | AT32: 1 | AU32: = | AV32: =AR32-AT32 -> 1 | AX32: 1 | AY32: - | AZ32: 1 | BA32: = | BB32: =AX32-AZ32 -> 0
B35: 4 | C35: ÷ | D35: 2 | E35: = | F35: =B35/D35 -> 2
B36: 6 | C36: ÷ | D36: 2 | E36: = | F36: =B36/D36 -> 3 | H36: 6 | I36: ÷ | J36: 3 | K36: = | L36: =H36/J36 -> 2
B37: 8 | C37: ÷ | D37: 2 | E37: = | F37: =B37/D37 -> 4 | H37: 9 | I37: ÷ | J37: 3 | K37: = | L37: =H37/J37 -> 3 | N37: 8 | O37: ÷ | P37: 4 | Q37: = | R37: =N37/P37 -> 2